Sheet: data
A1: A1 | B1: A2 | C1: A3 | D1: A4 | E1: A5 | F1: A6 | G1: A7 | H1: A8 | I1: A9 | J1: A10 | K1: A11 | L1: A12 | M1: A13 | N1: A14 | O1: A15 | P1: A16 | Q1: A17 | R1: A18 | S1: A19 | T1: A20 | U1: A21 | V1: A22 | W1: A23 | X1: A24 | Y1: A25 | Z1: A26 | AA1: A27 | AB1: A28 | AC1: A29 | AD1: A30
G2: List Price | K2: Down Payment | Q2: Net Price | S2: Interest | X2: Promotion
A3: Situation | B3: Floor | C3: Room | D3: Type | E3: Style | F3: Area | G3: Baht/Sqm. | H3: Unit Price | I3: Deposit | J3: Contract | K3: x7 | L3: Time | M3: x1 | N3: Time | O3: Tranfer | P3: Discount | Q3: Baht/Sqm. | R3: Unit Price | S3: Tranfer-Dis. | T3: 10 Year | U3: 15 Year | V3: 20 Year | W3: 25 Year | X3: 1 | Y3: 2 | Z3: 3 | AA3: 4 | AB3: 5 | AC3: 6 | AD3: 7
B4: 2 | C4: B1-201 | D4: B1 | E4: 1 Br | F4: 34.799999999999997 | G4: 65626.436781609198 | H4: 2283800 | I4: 10000 | J4: 50000 | K4: 12000 | L4: 1-7 | M4: 70000 | N4: 8 | O4: =RC[-7]-RC[-6]-RC[-5]-(RC[-4]*7)-RC[-2] -> 2069800 | P4: 0 | Q4: =RC[1]/RC[-11] -> 65626.436781609198 | R4: =RC[-10]-RC[-2] -> 2283800 | S4: =RC[-4]-RC[-3] -> 2069800 | T4: =RC[-1]*0.0107292 -> 22207.298159999998 | U4: =RC[-2]*0.0080388 -> 16638.70824 | V4: =RC[-3]*0.0067384 -> 13947.14032 | W4: =RC[-4]*0.0059925 -> 12403.276500000002 | X4: เครื่องปรับอากาศ 2 เครื่อง | Y4: ชุดครัว | Z4: Shower Box | AA4: Fully Furnished | AB4: เครื่องใช้ไฟฟ้า Samsung 5 รายการ | AC4: ผ่อนเงินดาวน์ 0% นาน 6 เดือน
B5: 2 | C5: B1-202 | D5: B1 | E5: 1 Br | F5: 34.799999999999997 | G5: 65626.436781609198 | H5: 2283800 | I5: 10000 | J5: 50000 | K5: 12000 | L5: 1-7 | M5: 70000 | N5: 8 | O5: =RC[-7]-RC[-6]-RC[-5]-(RC[-4]*7)-RC[-2] -> 2069800 | P5: 0 | Q5: =RC[1]/RC[-11] -> 65626.436781609198 | R5: =RC[-10]-RC[-2] -> 2283800 | S5: =RC[-4]-RC[-3] -> 2069800 | T5: =RC[-1]*0.0107292 -> 22207.298159999998 | U5: =RC[-2]*0.0080388 -> 16638.70824 | V5: =RC[-3]*0.0067384 -> 13947.14032 | W5: =RC[-4]*0.0059925 -> 12403.276500000002 | X5: เครื่องปรับอากาศ 2 เครื่อง | Y5: ชุดครัว | Z5: Shower Box | AA5: Fully Furnished | AB5: เครื่องใช้ไฟฟ้า Samsung 5 รายการ | AC5: ผ่อนเงินดาวน์ 0% นาน 6 เดือน
B6: 2 | C6: G-203 | D6: G | E6: 2 Br | F6: 70.8 | G6: 66881.355932203398 | H6: 4735200 | I6: 10000 | J6: 100000 | K6: 26000 | L6: 1-7 | M6: 147000 | N6: 8 | O6: =RC[-7]-RC[-6]-RC[-5]-(RC[-4]*7)-RC[-2] -> 4296200 | P6: 0 | Q6: =RC[1]/RC[-11] -> 66881.355932203398 | R6: =RC[-10]-RC[-2] -> 4735200 | S6: =RC[-4]-RC[-3] -> 4296200 | T6: =RC[-1]*0.0107292 -> 46094.789039999996 | U6: =RC[-2]*0.0080388 -> 34536.292560000002 | V6: =RC[-3]*0.0067384 -> 28949.514080000001 | W6: =RC[-4]*0.0059925 -> 25744.978500000001 | X6: เครื่องปรับอากาศ 3 เครื่อง | Y6: ชุดครัว | Z6: Shower Box | AA6: Fully Furnished | AB6: เครื่องใช้ไฟฟ้า Samsung 5 รายการ | AC6: ผ่อนเงินดาวน์ 0% นาน 6 เดือน
B7: 2 | C7: B1-204 | D7: B1 | E7: 1 Br | F7: 34.799999999999997 | G7: 65626.436781609198 | H7: 2283800 | I7: 10000 | J7: 50000 | K7: 12000 | L7: 1-7 | M7: 70000 | N7: 8 | O7: =RC[-7]-RC[-6]-RC[-5]-(RC[-4]*7)-RC[-2] -> 2069800 | P7: 0 | Q7: =RC[1]/RC[-11] -> 65626.436781609198 | R7: =RC[-10]-RC[-2] -> 2283800 | S7: =RC[-4]-RC[-3] -> 2069800 | T7: =RC[-1]*0.0107292 -> 22207.298159999998 | U7: =RC[-2]*0.0080388 -> 16638.70824 | V7: =RC[-3]*0.0067384 -> 13947.14032 | W7: =RC[-4]*0.0059925 -> 12403.276500000002 | X7: เครื่องปรับอากาศ 2 เครื่อง | Y7: ชุดครัว | Z7: Shower Box | AA7: Fully Furnished | AB7: เครื่องใช้ไฟฟ้า Samsung 5 รายการ | AC7: ผ่อนเงินดาวน์ 0% นาน 6 เดือน
A8: Sold Out | B8: 2 | C8: B-205 | D8: B | E8: 1 Br | F8: 30.8 | G8: 61650 | H8: 1898820
B9: 2 | C9: B-206 | D9: B | E9: 1 Br | F9: 30.8 | G9: 65253.246753246749 | H9: 2009800 | I9: 10000 | J9: 50000 | K9: 10000 | L9: 1-7 | M9: 59000 | N9: 8 | O9: =RC[-7]-RC[-6]-RC[-5]-(RC[-4]*7)-RC[-2] -> 1820800 | P9: 0 | Q9: =RC[1]/RC[-11] -> 65253.246753246749 | R9: =RC[-10]-RC[-2] -> 2009800 | S9: =RC[-4]-RC[-3] -> 1820800 | T9: =RC[-1]*0.0107292 -> 19535.727360000001 | U9: =RC[-2]*0.0080388 -> 14637.047040000001 | V9: =RC[-3]*0.0067384 -> 12269.27872 | W9: =RC[-4]*0.0059925 -> 10911.144 | X9: เครื่องปรับอากาศ 2 เครื่อง | Y9: ชุดครัว | Z9: Shower Box | AA9: Fully Furnished | AB9: เครื่องใช้ไฟฟ้า Samsung 5 รายการ | AC9: ผ่อนเงินดาวน์ 0% นาน 6 เดือน
B10: 2 | C10: D-207 | D10: D | E10: 1 Br | F10: 39.4 | G10: 66461.928934010153 | H10: 2618600 | I10: 10000 | J10: 50000 | K10: 15000 | L10: 1-7 | M10: 80000 | N10: 8 | O10: =RC[-7]-RC[-6]-RC[-5]-(RC[-4]*7)-RC[-2] -> 2373600 | P10: 0 | Q10: =RC[1]/RC[-11] -> 66461.928934010153 | R10: =RC[-10]-RC[-2] -> 2618600 | S10: =RC[-4]-RC[-3] -> 2373600 | T10: =RC[-1]*0.0107292 -> 25466.829119999999 | U10: =RC[-2]*0.0080388 -> 19080.895680000001 | V10: =RC[-3]*0.0067384 -> 15994.266240000001 | W10: =RC[-4]*0.0059925 -> 14223.798000000001 | X10: เครื่องปรับอากาศ 2 เครื่อง | Y10: ชุดครัว | Z10: Shower Box | AA10: Fully Furnished | AB10: เครื่องใช้ไฟฟ้า Samsung 5 รายการ | AC10: ผ่อนเงินดาวน์ 0% นาน 6 เดือน
B11: 2 | C11: B1-208 | D11: B1 | E11: 1 Br | F11: 34.799999999999997 | G11: 65626.436781609198 | H11: 2283800 | I11: 10000 | J11: 50000 | K11: 12000 | L11: 1-7 | M11: 70000 | N11: 8 | O11: =RC[-7]-RC[-6]-RC[-5]-(RC[-4]*7)-RC[-2] -> 2069800 | P11: 0 | Q11: =RC[1]/RC[-11] -> 65626.436781609198 | R11: =RC[-10]-RC[-2] -> 2283800 | S11: =RC[-4]-RC[-3] -> 2069800 | T11: =RC[-1]*0.0107292 -> 22207.298159999998 | U11: =RC[-2]*0.0080388 -> 16638.70824 | V11: =RC[-3]*0.0067384 -> 13947.14032 | W11: =RC[-4]*0.0059925 -> 12403.276500000002 | X11: เครื่องปรับอากาศ 2 เครื่อง | Y11: ชุดครัว | Z11: Shower Box | AA11: Fully Furnished | AB11: เครื่องใช้ไฟฟ้า Samsung 5 รายการ | AC11: ผ่อนเงินดาวน์ 0% นาน 6 เดือน
B12: 2 | C12: B1-209 | D12: B1 | E12: 1 Br | F12: 34.799999999999997 | G12: 65626.436781609198 | H12: 2283800 | I12: 10000 | J12: 50000 | K12: 12000 | L12: 1-7 | M12: 70000 | N12: 8 | O12: =RC[-7]-RC[-6]-RC[-5]-(RC[-4]*7)-RC[-2] -> 2069800 | P12: 0 | Q12: =RC[1]/RC[-11] -> 65626.436781609198 | R12: =RC[-10]-RC[-2] -> 2283800 | S12: =RC[-4]-RC[-3] -> 2069800 | T12: =RC[-1]*0.0107292 -> 22207.298159999998 | U12: =RC[-2]*0.0080388 -> 16638.70824 | V12: =RC[-3]*0.0067384 -> 13947.14032 | W12: =RC[-4]*0.0059925 -> 12403.276500000002 | X12: เครื่องปรับอากาศ 2 เครื่อง | Y12: ชุดครัว | Z12: Shower Box | AA12: Fully Furnished | AB12: เครื่องใช้ไฟฟ้า Samsung 5 รายการ | AC12: ผ่อนเงินดาวน์ 0% นาน 6 เดือน
B13: 2 | C13: B1-210 | D13: B1 | E13: 1 Br | F13: 34.799999999999997 | G13: 65626.436781609198 | H13: 2283800 | I13: 10000 | J13: 50000 | K13: 12000 | L13: 1-7 | M13: 70000 | N13: 8 | O13: =RC[-7]-RC[-6]-RC[-5]-(RC[-4]*7)-RC[-2] -> 2069800 | P13: 0 | Q13: =RC[1]/RC[-11] -> 65626.436781609198 | R13: =RC[-10]-RC[-2] -> 2283800 | S13: =RC[-4]-RC[-3] -> 2069800 | T13: =RC[-1]*0.0107292 -> 22207.298159999998 | U13: =RC[-2]*0.0080388 -> 16638.70824 | V13: =RC[-3]*0.0067384 -> 13947.14032 | W13: =RC[-4]*0.0059925 -> 12403.276500000002 | X13: เครื่องปรับอากาศ 2 เครื่อง | Y13: ชุดครัว | Z13: Shower Box | AA13: Fully Furnished | AB13: เครื่องใช้ไฟฟ้า Samsung 5 รายการ | AC13: ผ่อนเงินดาวน์ 0% นาน 6 เดือน
B14: 2 | C14: B1-211 | D14: B1 | E14: 1 Br | F14: 34.799999999999997 | G14: 65626.436781609198 | H14: 2283800 | I14: 10000 | J14: 50000 | K14: 12000 | L14: 1-7 | M14: 70000 | N14: 8 | O14: =RC[-7]-RC[-6]-RC[-5]-(RC[-4]*7)-RC[-2] -> 2069800 | P14: 0 | Q14: =RC[1]/RC[-11] -> 65626.436781609198 | R14: =RC[-10]-RC[-2] -> 2283800 | S14: =RC[-4]-RC[-3] -> 2069800 | T14: =RC[-1]*0.0107292 -> 22207.298159999998 | U14: =RC[-2]*0.0080388 -> 16638.70824 | V14: =RC[-3]*0.0067384 -> 13947.14032 | W14: =RC[-4]*0.0059925 -> 12403.276500000002 | X14: เครื่องปรับอากาศ 2 เครื่อง | Y14: ชุดครัว | Z14: Shower Box | AA14: Fully Furnished | AB14: เครื่องใช้ไฟฟ้า Samsung 5 รายการ | AC14: ผ่อนเงินดาวน์ 0% นาน 6 เดือน
B15: 2 | C15: F-212 | D15: F | E15: 2 Br | F15: 67.599999999999994 | G15: 66781.065088757401 | H15: 4514400 | I15: 10000 | J15: 100000 | K15: 25000 | L15: 1-7 | M15: 134000 | N15: 8 | O15: =RC[-7]-RC[-6]-RC[-5]-(RC[-4]*7)-RC[-2] -> 4095400 | P15: 0 | Q15: =RC[1]/RC[-11] -> 66781.065088757401 | R15: =RC[-10]-RC[-2] -> 4514400 | S15: =RC[-4]-RC[-3] -> 4095400 | T15: =RC[-1]*0.0107292 -> 43940.365679999995 | U15: =RC[-2]*0.0080388 -> 32922.101520000004 | V15: =RC[-3]*0.0067384 -> 27596.443360000001 | W15: =RC[-4]*0.0059925 -> 24541.684500000003 | X15: เครื่องปรับอากาศ 3 เครื่อง | Y15: ชุดครัว | Z15: Shower Box | AA15: Fully Furnished | AB15: เครื่องใช้ไฟฟ้า Samsung 5 รายการ | AC15: ผ่อนเงินดาวน์ 0% นาน 6 เดือน
B16: 2 | C16: A-213 | D16: A | E16: Studio | F16: 29.9 | G16: 63210.702341137126 | H16: 1890000 | I16: 10000 | J16: 50000 | K16: 9900 | L16: 1-7 | M16: 53000 | N16: 8 | O16: =RC[-7]-RC[-6]-RC[-5]-(RC[-4]*7)-RC[-2] -> 1707700 | P16: 0 | Q16: =RC[1]/RC[-11] -> 63210.702341137126 | R16: =RC[-10]-RC[-2] -> 1890000 | S16: =RC[-4]-RC[-3] -> 1707700 | T16: =RC[-1]*0.0107292 -> 18322.254839999998 | U16: =RC[-2]*0.0080388 -> 13727.858760000001 | V16: =RC[-3]*0.0067384 -> 11507.16568 | W16: =RC[-4]*0.0059925 -> 10233.392250000001 | X16: เครื่องปรับอากาศ 1 เครื่อง | Y16: ชุดครัว | Z16: Shower Box | AA16: Fully Furnished | AB16: เครื่องใช้ไฟฟ้า Samsung 5 รายการ | AC16: ผ่อนเงินดาวน์ 0% นาน 6 เดือน
B17: 2 | C17: A1-214 | D17: A1 | E17: Studio | F17: 29.9 | G17: 64882.943143812714 | H17: 1940000 | I17: 10000 | J17: 50000 | K17: 9900 | L17: 1-7 | M17: 53000 | N17: 8 | O17: =RC[-7]-RC[-6]-RC[-5]-(RC[-4]*7)-RC[-2] -> 1757700 | P17: 0 | Q17: =RC[1]/RC[-11] -> 64882.943143812714 | R17: =RC[-10]-RC[-2] -> 1940000 | S17: =RC[-4]-RC[-3] -> 1757700 | T17: =RC[-1]*0.0107292 -> 18858.714840000001 | U17: =RC[-2]*0.0080388 -> 14129.798760000001 | V17: =RC[-3]*0.0067384 -> 11844.08568 | W17: =RC[-4]*0.0059925 -> 10533.017250000001 | X17: เครื่องปรับอากาศ 2 เครื่อง | Y17: ชุดครัว | Z17: Shower Box | AA17: Fully Furnished | AB17: เครื่องใช้ไฟฟ้า Samsung 5 รายการ | AC17: ผ่อนเงินดาวน์ 0% นาน 6 เดือน
A18: Sold Out | B18: 3 | C18: B1-301 | D18: B1 | E18: 1 Br | F18: 34.799999999999997 | G18: 66500 | H18: 2314200
A19: Sold Out | B19: 3 | C19: B1-302 | D19: B1 | E19: 1 Br | F19: 34.799999999999997 | G19: 62550 | H19: 2176740
A20: Sold Out | B20: 3 | C20: G-303 | D20: G | E20: 2 Br | F20: 70.8 | G20: 63000 | H20: 4460400
B21: 3 | C21: B1-304 | D21: B1 | E21: 1 Br | F21: 34.799999999999997 | G21: 66626.436781609198 | H21: 2318600 | I21: 10000 | J21: 50000 | K21: 12000 | L21: 1-7 | M21: 73000 | N21: 8 | O21: =RC[-7]-RC[-6]-RC[-5]-(RC[-4]*7)-RC[-2] -> 2101600 | P21: 0 | Q21: =RC[1]/RC[-11] -> 66626.436781609198 | R21: =RC[-10]-RC[-2] -> 2318600 | S21: =RC[-4]-RC[-3] -> 2101600 | T21: =RC[-1]*0.0107292 -> 22548.486719999997 | U21: =RC[-2]*0.0080388 -> 16894.342080000002 | V21: =RC[-3]*0.0067384 -> 14161.42144 | W21: =RC[-4]*0.0059925 -> 12593.838000000002 | X21: เครื่องปรับอากาศ 2 เครื่อง | Y21: ชุดครัว | Z21: Shower Box | AA21: Fully Furnished | AB21: เครื่องใช้ไฟฟ้า Samsung 5 รายการ | AC21: ผ่อนเงินดาวน์ 0% นาน 6 เดือน
A22: Sold Out | B22: 3 | C22: B-305 | D22: B | E22: 1 Br | F22: 30.8 | G22: 62550 | H22: 1926540
A23: Sold Out | B23: 3 | C23: B-306 | D23: B | E23: 1 Br | F23: 30.8 | G23: 62550 | H23: 1926540
B24: 3 | C24: D-307 | D24: D | E24: 1 Br | F24: 39.4 | G24: 67461.928934010153 | H24: 2658000 | I24: 10000 | J24: 50000 | K24: 15000 | L24: 1-7 | M24: 83000 | N24: 8 | O24: =RC[-7]-RC[-6]-RC[-5]-(RC[-4]*7)-RC[-2] -> 2410000 | P24: 0 | Q24: =RC[1]/RC[-11] -> 67461.928934010153 | R24: =RC[-10]-RC[-2] -> 2658000 | S24: =RC[-4]-RC[-3] -> 2410000 | T24: =RC[-1]*0.0107292 -> 25857.371999999999 | U24: =RC[-2]*0.0080388 -> 19373.508000000002 | V24: =RC[-3]*0.0067384 -> 16239.544 | W24: =RC[-4]*0.0059925 -> 14441.925000000001 | X24: เครื่องปรับอากาศ 2 เครื่อง | Y24: ชุดครัว | Z24: Shower Box | AA24: Fully Furnished | AB24: เครื่องใช้ไฟฟ้า Samsung 5 รายการ | AC24: ผ่อนเงินดาวน์ 0% นาน 6 เดือน
B25: 3 | C25: B1-308 | D25: B1 | E25: 1 Br | F25: 34.799999999999997 | G25: 66626.436781609198 | H25: 2318600 | I25: 10000 | J25: 50000 | K25: 12000 | L25: 1-7 | M25: 73000 | N25: 8 | O25: =RC[-7]-RC[-6]-RC[-5]-(RC[-4]*7)-RC[-2] -> 2101600 | P25: 0 | Q25: =RC[1]/RC[-11] -> 66626.436781609198 | R25: =RC[-10]-RC[-2] -> 2318600 | S25: =RC[-4]-RC[-3] -> 2101600 | T25: =RC[-1]*0.0107292 -> 22548.486719999997 | U25: =RC[-2]*0.0080388 -> 16894.342080000002 | V25: =RC[-3]*0.0067384 -> 14161.42144 | W25: =RC[-4]*0.0059925 -> 12593.838000000002 | X25: เครื่องปรับอากาศ 2 เครื่อง | Y25: ชุดครัว | Z25: Shower Box | AA25: Fully Furnished | AB25: เครื่องใช้ไฟฟ้า Samsung 5 รายการ | AC25: ผ่อนเงินดาวน์ 0% นาน 6 เดือน
B26: 3 | C26: B1-309 | D26: B1 | E26: 1 Br | F26: 34.799999999999997 | G26: 66626.436781609198 | H26: 2318600 | I26: 10000 | J26: 50000 | K26: 12000 | L26: 1-7 | M26: 73000 | N26: 8 | O26: =RC[-7]-RC[-6]-RC[-5]-(RC[-4]*7)-RC[-2] -> 2101600 | P26: 0 | Q26: =RC[1]/RC[-11] -> 66626.436781609198 | R26: =RC[-10]-RC[-2] -> 2318600 | S26: =RC[-4]-RC[-3] -> 2101600 | T26: =RC[-1]*0.0107292 -> 22548.486719999997 | U26: =RC[-2]*0.0080388 -> 16894.342080000002 | V26: =RC[-3]*0.0067384 -> 14161.42144 | W26: =RC[-4]*0.0059925 -> 12593.838000000002 | X26: เครื่องปรับอากาศ 2 เครื่อง | Y26: ชุดครัว | Z26: Shower Box | AA26: Fully Furnished | AB26: เครื่องใช้ไฟฟ้า Samsung 5 รายการ | AC26: ผ่อนเงินดาวน์ 0% นาน 6 เดือน
B27: 3 | C27: B1-310 | D27: B1 | E27: 1 Br | F27: 34.799999999999997 | G27: 66626.436781609198 | H27: 2318600 | I27: 10000 | J27: 50000 | K27: 12000 | L27: 1-7 | M27: 73000 | N27: 8 | O27: =RC[-7]-RC[-6]-RC[-5]-(RC[-4]*7)-RC[-2] -> 2101600 | P27: 0 | Q27: =RC[1]/RC[-11] -> 66626.436781609198 | R27: =RC[-10]-RC[-2] -> 2318600 | S27: =RC[-4]-RC[-3] -> 2101600 | T27: =RC[-1]*0.0107292 -> 22548.486719999997 | U27: =RC[-2]*0.0080388 -> 16894.342080000002 | V27: =RC[-3]*0.0067384 -> 14161.42144 | W27: =RC[-4]*0.0059925 -> 12593.838000000002 | X27: เครื่องปรับอากาศ 2 เครื่อง | Y27: ชุดครัว | Z27: Shower Box | AA27: Fully Furnished | AB27: เครื่องใช้ไฟฟ้า Samsung 5 รายการ | AC27: ผ่อนเงินดาวน์ 0% นาน 6 เดือน
B28: 3 | C28: B1-311 | D28: B1 | E28: 1 Br | F28: 34.799999999999997 | G28: 66626.436781609198 | H28: 2318600 | I28: 10000 | J28: 50000 | K28: 12000 | L28: 1-7 | M28: 73000 | N28: 8 | O28: =RC[-7]-RC[-6]-RC[-5]-(RC[-4]*7)-RC[-2] -> 2101600 | P28: 0 | Q28: =RC[1]/RC[-11] -> 66626.436781609198 | R28: =RC[-10]-RC[-2] -> 2318600 | S28: =RC[-4]-RC[-3] -> 2101600 | T28: =RC[-1]*0.0107292 -> 22548.486719999997 | U28: =RC[-2]*0.0080388 -> 16894.342080000002 | V28: =RC[-3]*0.0067384 -> 14161.42144 | W28: =RC[-4]*0.0059925 -> 12593.838000000002 | X28: เครื่องปรับอากาศ 2 เครื่อง | Y28: ชุดครัว | Z28: Shower Box | AA28: Fully Furnished | AB28: เครื่องใช้ไฟฟ้า Samsung 5 รายการ | AC28: ผ่อนเงินดาวน์ 0% นาน 6 เดือน
B29: 3 | C29: F-312 | D29: F | E29: 2 Br | F29: 67.599999999999994 | G29: 67781.065088757401 | H29: 4582000 | I29: 10000 | J29: 100000 | K29: 25000 | L29: 1-7 | M29: 140000 | N29: 8 | O29: =RC[-7]-RC[-6]-RC[-5]-(RC[-4]*7)-RC[-2] -> 4157000 | P29: 0 | Q29: =RC[1]/RC[-11] -> 67781.065088757401 | R29: =RC[-10]-RC[-2] -> 4582000 | S29: =RC[-4]-RC[-3] -> 4157000 | T29: =RC[-1]*0.0107292 -> 44601.284399999997 | U29: =RC[-2]*0.0080388 -> 33417.291600000004 | V29: =RC[-3]*0.0067384 -> 28011.5288 | W29: =RC[-4]*0.0059925 -> 24910.822500000002 | X29: เครื่องปรับอากาศ 3 เครื่อง | Y29: ชุดครัว | Z29: Shower Box | AA29: Fully Furnished | AB29: เครื่องใช้ไฟฟ้า Samsung 5 รายการ | AC29: ผ่อนเงินดาวน์ 0% นาน 6 เดือน
B30: 3 | C30: A-313 | D30: A | E30: Studio | F30: 29.9 | G30: 65655.51839464884 | H30: 1963100 | I30: 10000 | J30: 50000 | K30: 9900 | L30: 1-7 | M30: 56000 | N30: 8 | O30: =RC[-7]-RC[-6]-RC[-5]-(RC[-4]*7)-RC[-2] -> 1777800 | P30: 0 | Q30: =RC[1]/RC[-11] -> 65655.51839464884 | R30: =RC[-10]-RC[-2] -> 1963100 | S30: =RC[-4]-RC[-3] -> 1777800 | T30: =RC[-1]*0.0107292 -> 19074.371759999998 | U30: =RC[-2]*0.0080388 -> 14291.378640000001 | V30: =RC[-3]*0.0067384 -> 11979.52752 | W30: =RC[-4]*0.0059925 -> 10653.4665 | X30: เครื่องปรับอากาศ 1 เครื่อง | Y30: ชุดครัว | Z30: Shower Box | AA30: Fully Furnished | AB30: เครื่องใช้ไฟฟ้า Samsung 5 รายการ | AC30: ผ่อนเงินดาวน์ 0% นาน 6 เดือน
B31: 3 | C31: A1-314 | D31: A1 | E31: Studio | F31: 29.9 | G31: 67327.759197324413 | H31: 2013100 | I31: 10000 | J31: 50000 | K31: 9900 | L31: 1-7 | M31: 56000 | N31: 8 | O31: =RC[-7]-RC[-6]-RC[-5]-(RC[-4]*7)-RC[-2] -> 1827800 | P31: 0 | Q31: =RC[1]/RC[-11] -> 67327.759197324413 | R31: =RC[-10]-RC[-2] -> 2013100 | S31: =RC[-4]-RC[-3] -> 1827800 | T31: =RC[-1]*0.0107292 -> 19610.831759999997 | U31: =RC[-2]*0.0080388 -> 14693.318640000001 | V31: =RC[-3]*0.0067384 -> 12316.44752 | W31: =RC[-4]*0.0059925 -> 10953.0915 | X31: เครื่องปรับอากาศ 2 เครื่อง | Y31: ชุดครัว | Z31: Shower Box | AA31: Fully Furnished | AB31: เครื่องใช้ไฟฟ้า Samsung 5 รายการ | AC31: ผ่อนเงินดาวน์ 0% นาน 6 เดือน
B32: 3 | C32: B1-315 | D32: B1 | E32: 1 Br | F32: 34.799999999999997 | G32: 66626.436781609198 | H32: 2318600 | I32: 10000 | J32: 50000 | K32: 12000 | L32: 1-7 | M32: 73000 | N32: 8 | O32: =RC[-7]-RC[-6]-RC[-5]-(RC[-4]*7)-RC[-2] -> 2101600 | P32: 0 | Q32: =RC[1]/RC[-11] -> 66626.436781609198 | R32: =RC[-10]-RC[-2] -> 2318600 | S32: =RC[-4]-RC[-3] -> 2101600 | T32: =RC[-1]*0.0107292 -> 22548.486719999997 | U32: =RC[-2]*0.0080388 -> 16894.342080000002 | V32: =RC[-3]*0.0067384 -> 14161.42144 | W32: =RC[-4]*0.0059925 -> 12593.838000000002 | X32: เครื่องปรับอากาศ 2 เครื่อง | Y32: ชุดครัว | Z32: Shower Box | AA32: Fully Furnished | AB32: เครื่องใช้ไฟฟ้า Samsung 5 รายการ | AC32: ผ่อนเงินดาวน์ 0% นาน 6 เดือน
A33: Sold Out | B33: 3 | C33: E-316 | D33: E | E33: 2 Br | F33: 50.3 | G33: 63000 | H33: 3168900
A34: Sold Out | B34: 3 | C34: C-317 | D34: C | E34: 1 Br | F34: 37.299999999999997 | G34: 67000 | H34: 2499100
A35: Sold Out | B35: 3 | C35: B-318 | D35: B | E35: 1 Br | F35: 30.8 | G35: 69500 | H35: 2140600
B36: 4 | C36: B1-401 | D36: B1 | E36: 1 Br | F36: 34.799999999999997 | G36: 67626.436781609198 | H36: 2353400 | I36: 10000 | J36: 50000 | K36: 12000 | L36: 1-7 | M36: 76000 | N36: 8 | O36: =RC[-7]-RC[-6]-RC[-5]-(RC[-4]*7)-RC[-2] -> 2133400 | P36: 0 | Q36: =RC[1]/RC[-11] -> 67626.436781609198 | R36: =RC[-10]-RC[-2] -> 2353400 | S36: =RC[-4]-RC[-3] -> 2133400 | T36: =RC[-1]*0.0107292 -> 22889.675279999999 | U36: =RC[-2]*0.0080388 -> 17149.975920000001 | V36: =RC[-3]*0.0067384 -> 14375.70256 | W36: =RC[-4]*0.0059925 -> 12784.399500000001 | X36: เครื่องปรับอากาศ 2 เครื่อง | Y36: ชุดครัว | Z36: Shower Box | AA36: Fully Furnished | AB36: เครื่องใช้ไฟฟ้า Samsung 5 รายการ | AC36: ผ่อนเงินดาวน์ 0% นาน 6 เดือน
B37: 4 | C37: B1-402 | D37: B1 | E37: 1 Br | F37: 34.799999999999997 | G37: 67626.436781609198 | H37: 2353400 | I37: 10000 | J37: 50000 | K37: 12000 | L37: 1-7 | M37: 76000 | N37: 8 | O37: =RC[-7]-RC[-6]-RC[-5]-(RC[-4]*7)-RC[-2] -> 2133400 | P37: 0 | Q37: =RC[1]/RC[-11] -> 67626.436781609198 | R37: =RC[-10]-RC[-2] -> 2353400 | S37: =RC[-4]-RC[-3] -> 2133400 | T37: =RC[-1]*0.0107292 -> 22889.675279999999 | U37: =RC[-2]*0.0080388 -> 17149.975920000001 | V37: =RC[-3]*0.0067384 -> 14375.70256 | W37: =RC[-4]*0.0059925 -> 12784.399500000001 | X37: เครื่องปรับอากาศ 2 เครื่อง | Y37: ชุดครัว | Z37: Shower Box | AA37: Fully Furnished | AB37: เครื่องใช้ไฟฟ้า Samsung 5 รายการ | AC37: ผ่อนเงินดาวน์ 0% นาน 6 เดือน
A38: Sold Out | B38: 4 | C38: G-403 | D38: G | E38: 2 Br | F38: 70.8 | G38: 63900 | H38: 4524120
B39: 4 | C39: B1-404 | D39: B1 | E39: 1 Br | F39: 34.799999999999997 | G39: 67626.436781609198 | H39: 2353400 | I39: 10000 | J39: 50000 | K39: 12000 | L39: 1-7 | M39: 76000 | N39: 8 | O39: =RC[-7]-RC[-6]-RC[-5]-(RC[-4]*7)-RC[-2] -> 2133400 | P39: 0 | Q39: =RC[1]/RC[-11] -> 67626.436781609198 | R39: =RC[-10]-RC[-2] -> 2353400 | S39: =RC[-4]-RC[-3] -> 2133400 | T39: =RC[-1]*0.0107292 -> 22889.675279999999 | U39: =RC[-2]*0.0080388 -> 17149.975920000001 | V39: =RC[-3]*0.0067384 -> 14375.70256 | W39: =RC[-4]*0.0059925 -> 12784.399500000001 | X39: เครื่องปรับอากาศ 2 เครื่อง | Y39: ชุดครัว | Z39: Shower Box | AA39: Fully Furnished | AB39: เครื่องใช้ไฟฟ้า Samsung 5 รายการ | AC39: ผ่อนเงินดาวน์ 0% นาน 6 เดือน
A40: Sold Out | B40: 4 | C40: B-405 | D40: B | E40: 1 Br | F40: 30.8 | G40: 63450 | H40: 1954260
B41: 4 | C41: B-406 | D41: B | E41: 1 Br | F41: 30.8 | G41: 67253.246753246756 | H41: 2071400 | I41: 10000 | J41: 50000 | K41: 10000 | L41: 1-7 | M41: 65000 | N41: 8 | O41: =RC[-7]-RC[-6]-RC[-5]-(RC[-4]*7)-RC[-2] -> 1876400 | P41: 0 | Q41: =RC[1]/RC[-11] -> 67253.246753246756 | R41: =RC[-10]-RC[-2] -> 2071400 | S41: =RC[-4]-RC[-3] -> 1876400 | T41: =RC[-1]*0.0107292 -> 20132.27088 | U41: =RC[-2]*0.0080388 -> 15084.00432 | V41: =RC[-3]*0.0067384 -> 12643.93376 | W41: =RC[-4]*0.0059925 -> 11244.327000000001 | X41: เครื่องปรับอากาศ 2 เครื่อง | Y41: ชุดครัว | Z41: Shower Box | AA41: Fully Furnished | AB41: เครื่องใช้ไฟฟ้า Samsung 5 รายการ | AC41: ผ่อนเงินดาวน์ 0% นาน 6 เดือน
B42: 4 | C42: D-407 | D42: D | E42: 1 Br | F42: 39.4 | G42: 68461.928934010153 | H42: 2697400 | I42: 10000 | J42: 50000 | K42: 15000 | L42: 1-7 | M42: 86000 | N42: 8 | O42: =RC[-7]-RC[-6]-RC[-5]-(RC[-4]*7)-RC[-2] -> 2446400 | P42: 0 | Q42: =RC[1]/RC[-11] -> 68461.928934010153 | R42: =RC[-10]-RC[-2] -> 2697400 | S42: =RC[-4]-RC[-3] -> 2446400 | T42: =RC[-1]*0.0107292 -> 26247.91488 | U42: =RC[-2]*0.0080388 -> 19666.120320000002 | V42: =RC[-3]*0.0067384 -> 16484.821759999999 | W42: =RC[-4]*0.0059925 -> 14660.052000000001 | X42: เครื่องปรับอากาศ 2 เครื่อง | Y42: ชุดครัว | Z42: Shower Box | AA42: Fully Furnished | AB42: เครื่องใช้ไฟฟ้า Samsung 5 รายการ | AC42: ผ่อนเงินดาวน์ 0% นาน 6 เดือน
B43: 4 | C43: B1-408 | D43: B1 | E43: 1 Br | F43: 34.799999999999997 | G43: 67626.436781609198 | H43: 2353400 | I43: 10000 | J43: 50000 | K43: 12000 | L43: 1-7 | M43: 76000 | N43: 8 | O43: =RC[-7]-RC[-6]-RC[-5]-(RC[-4]*7)-RC[-2] -> 2133400 | P43: 0 | Q43: =RC[1]/RC[-11] -> 67626.436781609198 | R43: =RC[-10]-RC[-2] -> 2353400 | S43: =RC[-4]-RC[-3] -> 2133400 | T43: =RC[-1]*0.0107292 -> 22889.675279999999 | U43: =RC[-2]*0.0080388 -> 17149.975920000001 | V43: =RC[-3]*0.0067384 -> 14375.70256 | W43: =RC[-4]*0.0059925 -> 12784.399500000001 | X43: เครื่องปรับอากาศ 2 เครื่อง | Y43: ชุดครัว | Z43: Shower Box | AA43: Fully Furnished | AB43: เครื่องใช้ไฟฟ้า Samsung 5 รายการ | AC43: ผ่อนเงินดาวน์ 0% นาน 6 เดือน
B44: 4 | C44: B1-409 | D44: B1 | E44: 1 Br | F44: 34.799999999999997 | G44: 67626.436781609198 | H44: 2353400 | I44: 10000 | J44: 50000 | K44: 12000 | L44: 1-7 | M44: 76000 | N44: 8 | O44: =RC[-7]-RC[-6]-RC[-5]-(RC[-4]*7)-RC[-2] -> 2133400 | P44: 0 | Q44: =RC[1]/RC[-11] -> 67626.436781609198 | R44: =RC[-10]-RC[-2] -> 2353400 | S44: =RC[-4]-RC[-3] -> 2133400 | T44: =RC[-1]*0.0107292 -> 22889.675279999999 | U44: =RC[-2]*0.0080388 -> 17149.975920000001 | V44: =RC[-3]*0.0067384 -> 14375.70256 | W44: =RC[-4]*0.0059925 -> 12784.399500000001 | X44: เครื่องปรับอากาศ 2 เครื่อง | Y44: ชุดครัว | Z44: Shower Box | AA44: Fully Furnished | AB44: เครื่องใช้ไฟฟ้า Samsung 5 รายการ | AC44: ผ่อนเงินดาวน์ 0% นาน 6 เดือน
B45: 4 | C45: B1-410 | D45: B1 | E45: 1 Br | F45: 34.799999999999997 | G45: 67626.436781609198 | H45: 2353400 | I45: 10000 | J45: 50000 | K45: 12000 | L45: 1-7 | M45: 76000 | N45: 8 | O45: =RC[-7]-RC[-6]-RC[-5]-(RC[-4]*7)-RC[-2] -> 2133400 | P45: 0 | Q45: =RC[1]/RC[-11] -> 67626.436781609198 | R45: =RC[-10]-RC[-2] -> 2353400 | S45: =RC[-4]-RC[-3] -> 2133400 | T45: =RC[-1]*0.0107292 -> 22889.675279999999 | U45: =RC[-2]*0.0080388 -> 17149.975920000001 | V45: =RC[-3]*0.0067384 -> 14375.70256 | W45: =RC[-4]*0.0059925 -> 12784.399500000001 | X45: เครื่องปรับอากาศ 2 เครื่อง | Y45: ชุดครัว | Z45: Shower Box | AA45: Fully Furnished | AB45: เครื่องใช้ไฟฟ้า Samsung 5 รายการ | AC45: ผ่อนเงินดาวน์ 0% นาน 6 เดือน
B46: 4 | C46: B1-411 | D46: B1 | E46: 1 Br | F46: 34.799999999999997 | G46: 67626.436781609198 | H46: 2353400 | I46: 10000 | J46: 50000 | K46: 12000 | L46: 1-7 | M46: 76000 | N46: 8 | O46: =RC[-7]-RC[-6]-RC[-5]-(RC[-4]*7)-RC[-2] -> 2133400 | P46: 0 | Q46: =RC[1]/RC[-11] -> 67626.436781609198 | R46: =RC[-10]-RC[-2] -> 2353400 | S46: =RC[-4]-RC[-3] -> 2133400 | T46: =RC[-1]*0.0107292 -> 22889.675279999999 | U46: =RC[-2]*0.0080388 -> 17149.975920000001 | V46: =RC[-3]*0.0067384 -> 14375.70256 | W46: =RC[-4]*0.0059925 -> 12784.399500000001 | X46: เครื่องปรับอากาศ 2 เครื่อง | Y46: ชุดครัว | Z46: Shower Box | AA46: Fully Furnished | AB46: เครื่องใช้ไฟฟ้า Samsung 5 รายการ | AC46: ผ่อนเงินดาวน์ 0% นาน 6 เดือน
B47: 4 | C47: F-412 | D47: F | E47: 2 Br | F47: 67.599999999999994 | G47: 68781.065088757401 | H47: 4649600 | I47: 10000 | J47: 100000 | K47: 25000 | L47: 1-7 | M47: 146000 | N47: 8 | O47: =RC[-7]-RC[-6]-RC[-5]-(RC[-4]*7)-RC[-2] -> 4218600 | P47: 0 | Q47: =RC[1]/RC[-11] -> 68781.065088757401 | R47: =RC[-10]-RC[-2] -> 4649600 | S47: =RC[-4]-RC[-3] -> 4218600 | T47: =RC[-1]*0.0107292 -> 45262.203119999998 | U47: =RC[-2]*0.0080388 -> 33912.481680000004 | V47: =RC[-3]*0.0067384 -> 28426.614240000003 | W47: =RC[-4]*0.0059925 -> 25279.960500000001 | X47: เครื่องปรับอากาศ 3 เครื่อง | Y47: ชุดครัว | Z47: Shower Box | AA47: Fully Furnished | AB47: เครื่องใช้ไฟฟ้า Samsung 5 รายการ | AC47: ผ่อนเงินดาวน์ 0% นาน 6 เดือน
B48: 4 | C48: A-413 | D48: A | E48: Studio | F48: 29.9 | G48: 66655.51839464884 | H48: 1993000 | I48: 10000 | J48: 50000 | K48: 9900 | L48: 1-7 | M48: 59000 | N48: 8 | O48: =RC[-7]-RC[-6]-RC[-5]-(RC[-4]*7)-RC[-2] -> 1804700 | P48: 0 | Q48: =RC[1]/RC[-11] -> 66655.51839464884 | R48: =RC[-10]-RC[-2] -> 1993000 | S48: =RC[-4]-RC[-3] -> 1804700 | T48: =RC[-1]*0.0107292 -> 19362.987239999999 | U48: =RC[-2]*0.0080388 -> 14507.622360000001 | V48: =RC[-3]*0.0067384 -> 12160.79048 | W48: =RC[-4]*0.0059925 -> 10814.66475 | X48: เครื่องปรับอากาศ 1 เครื่อง | Y48: ชุดครัว | Z48: Shower Box | AA48: Fully Furnished | AB48: เครื่องใช้ไฟฟ้า Samsung 5 รายการ | AC48: ผ่อนเงินดาวน์ 0% นาน 6 เดือน
B49: 4 | C49: A1-414 | D49: A1 | E49: Studio | F49: 29.9 | G49: 68327.759197324413 | H49: 2043000 | I49: 10000 | J49: 50000 | K49: 9900 | L49: 1-7 | M49: 59000 | N49: 8 | O49: =RC[-7]-RC[-6]-RC[-5]-(RC[-4]*7)-RC[-2] -> 1854700 | P49: 0 | Q49: =RC[1]/RC[-11] -> 68327.759197324413 | R49: =RC[-10]-RC[-2] -> 2043000 | S49: =RC[-4]-RC[-3] -> 1854700 | T49: =RC[-1]*0.0107292 -> 19899.447239999998 | U49: =RC[-2]*0.0080388 -> 14909.562360000002 | V49: =RC[-3]*0.0067384 -> 12497.71048 | W49: =RC[-4]*0.0059925 -> 11114.28975 | X49: เครื่องปรับอากาศ 2 เครื่อง | Y49: ชุดครัว | Z49: Shower Box | AA49: Fully Furnished | AB49: เครื่องใช้ไฟฟ้า Samsung 5 รายการ | AC49: ผ่อนเงินดาวน์ 0% นาน 6 เดือน
B50: 4 | C50: B1-415 | D50: B1 | E50: 1 Br | F50: 34.799999999999997 | G50: 67626.436781609198 | H50: 2353400 | I50: 10000 | J50: 50000 | K50: 12000 | L50: 1-7 | M50: 76000 | N50: 8 | O50: =RC[-7]-RC[-6]-RC[-5]-(RC[-4]*7)-RC[-2] -> 2133400 | P50: 0 | Q50: =RC[1]/RC[-11] -> 67626.436781609198 | R50: =RC[-10]-RC[-2] -> 2353400 | S50: =RC[-4]-RC[-3] -> 2133400 | T50: =RC[-1]*0.0107292 -> 22889.675279999999 | U50: =RC[-2]*0.0080388 -> 17149.975920000001 | V50: =RC[-3]*0.0067384 -> 14375.70256 | W50: =RC[-4]*0.0059925 -> 12784.399500000001 | X50: เครื่องปรับอากาศ 2 เครื่อง | Y50: ชุดครัว | Z50: Shower Box | AA50: Fully Furnished | AB50: เครื่องใช้ไฟฟ้า Samsung 5 รายการ | AC50: ผ่อนเงินดาวน์ 0% นาน 6 เดือน
A51: Sold Out | B51: 4 | C51: E-416 | D51: E | E51: 1 Br | F51: 50.3 | G51: 68000 | H51: 3420400
B52: 4 | C52: C-417 | D52: C | E52: 1 Br | F52: 37.299999999999997 | G52: 68319.034852546916 | H52: 2548300 | I52: 10000 | J52: 50000 | K52: 14000 | L52: 1-7 | M52: 80000 | N52: 8 | O52: =RC[-7]-RC[-6]-RC[-5]-(RC[-4]*7)-RC[-2] -> 2310300 | P52: 0 | Q52: =RC[1]/RC[-11] -> 68319.034852546916 | R52: =RC[-10]-RC[-2] -> 2548300 | S52: =RC[-4]-RC[-3] -> 2310300 | T52: =RC[-1]*0.0107292 -> 24787.670759999997 | U52: =RC[-2]*0.0080388 -> 18572.039640000003 | V52: =RC[-3]*0.0067384 -> 15567.72552 | W52: =RC[-4]*0.0059925 -> 13844.472750000001 | X52: เครื่องปรับอากาศ 2 เครื่อง | Y52: ชุดครัว | Z52: Shower Box | AA52: Fully Furnished | AB52: เครื่องใช้ไฟฟ้า Samsung 5 รายการ | AC52: ผ่อนเงินดาวน์ 0% นาน 6 เดือน
A53: Sold Out | B53: 4 | C53: B-418 | D53: B | E53: 1 Br | F53: 30.8 | G53: 63450 | H53: 1954260
B54: 5 | C54: B1-501 | D54: B1 | E54: 1 Br | F54: 34.799999999999997 | G54: 68626.436781609198 | H54: 2388200 | I54: 10000 | J54: 50000 | K54: 12000 | L54: 1-7 | M54: 79000 | N54: 8 | O54: =RC[-7]-RC[-6]-RC[-5]-(RC[-4]*7)-RC[-2] -> 2165200 | P54: 0 | Q54: =RC[1]/RC[-11] -> 68626.436781609198 | R54: =RC[-10]-RC[-2] -> 2388200 | S54: =RC[-4]-RC[-3] -> 2165200 | T54: =RC[-1]*0.0107292 -> 23230.863839999998 | U54: =RC[-2]*0.0080388 -> 17405.609759999999 | V54: =RC[-3]*0.0067384 -> 14589.983680000001 | W54: =RC[-4]*0.0059925 -> 12974.961000000001 | X54: เครื่องปรับอากาศ 2 เครื่อง | Y54: ชุดครัว | Z54: Shower Box | AA54: Fully Furnished | AB54: เครื่องใช้ไฟฟ้า Samsung 5 รายการ | AC54: ผ่อนเงินดาวน์ 0% นาน 6 เดือน
A55: Sold Out | B55: 5 | C55: B1-502 | D55: B1 | E55: 1 Br | F55: 34.799999999999997 | G55: 64350 | H55: 2239380
B56: 5 | C56: G-503 | D56: G | E56: 2 Br | F56: 70.8 | G56: 69881.355932203398 | H56: 4947600 | I56: 10000 | J56: 100000 | K56: 26000 | L56: 1-7 | M56: 166000 | N56: 8 | O56: =RC[-7]-RC[-6]-RC[-5]-(RC[-4]*7)-RC[-2] -> 4489600 | P56: 0 | Q56: =RC[1]/RC[-11] -> 69881.355932203398 | R56: =RC[-10]-RC[-2] -> 4947600 | S56: =RC[-4]-RC[-3] -> 4489600 | T56: =RC[-1]*0.0107292 -> 48169.816319999998 | U56: =RC[-2]*0.0080388 -> 36090.996480000002 | V56: =RC[-3]*0.0067384 -> 30252.72064 | W56: =RC[-4]*0.0059925 -> 26903.928000000004 | X56: เครื่องปรับอากาศ 3 เครื่อง | Y56: ชุดครัว | Z56: Shower Box | AA56: Fully Furnished | AB56: เครื่องใช้ไฟฟ้า Samsung 5 รายการ | AC56: ผ่อนเงินดาวน์ 0% นาน 6 เดือน
B57: 5 | C57: B1-504 | D57: B1 | E57: 1 Br | F57: 34.799999999999997 | G57: 68626.436781609198 | H57: 2388200 | I57: 10000 | J57: 50000 | K57: 12000 | L57: 1-7 | M57: 79000 | N57: 8 | O57: =RC[-7]-RC[-6]-RC[-5]-(RC[-4]*7)-RC[-2] -> 2165200 | P57: 0 | Q57: =RC[1]/RC[-11] -> 68626.436781609198 | R57: =RC[-10]-RC[-2] -> 2388200 | S57: =RC[-4]-RC[-3] -> 2165200 | T57: =RC[-1]*0.0107292 -> 23230.863839999998 | U57: =RC[-2]*0.0080388 -> 17405.609759999999 | V57: =RC[-3]*0.0067384 -> 14589.983680000001 | W57: =RC[-4]*0.0059925 -> 12974.961000000001 | X57: เครื่องปรับอากาศ 2 เครื่อง | Y57: ชุดครัว | Z57: Shower Box | AA57: Fully Furnished | AB57: เครื่องใช้ไฟฟ้า Samsung 5 รายการ | AC57: ผ่อนเงินดาวน์ 0% นาน 6 เดือน
A58: Sold Out | B58: 5 | C58: B-505 | D58: B | E58: 1 Br | F58: 30.8 | G58: 64350 | H58: 1981980
B59: 5 | C59: B-506 | D59: B | E59: 1 Br | F59: 30.8 | G59: 68253.246753246756 | H59: 2102200 | I59: 10000 | J59: 50000 | K59: 10000 | L59: 1-7 | M59: 68000 | N59: 8 | O59: =RC[-7]-RC[-6]-RC[-5]-(RC[-4]*7)-RC[-2] -> 1904200 | P59: 0 | Q59: =RC[1]/RC[-11] -> 68253.246753246756 | R59: =RC[-10]-RC[-2] -> 2102200 | S59: =RC[-4]-RC[-3] -> 1904200 | T59: =RC[-1]*0.0107292 -> 20430.54264 | U59: =RC[-2]*0.0080388 -> 15307.482960000001 | V59: =RC[-3]*0.0067384 -> 12831.261280000001 | W59: =RC[-4]*0.0059925 -> 11410.918500000002 | X59: เครื่องปรับอากาศ 2 เครื่อง | Y59: ชุดครัว | Z59: Shower Box | AA59: Fully Furnished | AB59: เครื่องใช้ไฟฟ้า Samsung 5 รายการ | AC59: ผ่อนเงินดาวน์ 0% นาน 6 เดือน
A60: Sold Out | B60: 5 | C60: D-507 | D60: D | E60: 1 Br | F60: 39.4 | G60: 64800 | H60: 2553120
B61: 5 | C61: B1-508 | D61: B1 | E61: 1 Br | F61: 34.799999999999997 | G61: 68626.436781609198 | H61: 2388200 | I61: 10000 | J61: 50000 | K61: 12000 | L61: 1-7 | M61: 79000 | N61: 8 | O61: =RC[-7]-RC[-6]-RC[-5]-(RC[-4]*7)-RC[-2] -> 2165200 | P61: 0 | Q61: =RC[1]/RC[-11] -> 68626.436781609198 | R61: =RC[-10]-RC[-2] -> 2388200 | S61: =RC[-4]-RC[-3] -> 2165200 | T61: =RC[-1]*0.0107292 -> 23230.863839999998 | U61: =RC[-2]*0.0080388 -> 17405.609759999999 | V61: =RC[-3]*0.0067384 -> 14589.983680000001 | W61: =RC[-4]*0.0059925 -> 12974.961000000001 | X61: เครื่องปรับอากาศ 2 เครื่อง | Y61: ชุดครัว | Z61: Shower Box | AA61: Fully Furnished | AB61: เครื่องใช้ไฟฟ้า Samsung 5 รายการ | AC61: ผ่อนเงินดาวน์ 0% นาน 6 เดือน
A62: Sold Out | B62: 5 | C62: B1-509 | D62: B1 | E62: 1 Br | F62: 34.799999999999997 | G62: 64350 | H62: 2239380
B63: 5 | C63: B1-510 | D63: B1 | E63: 1 Br | F63: 34.799999999999997 | G63: 68626.436781609198 | H63: 2388200 | I63: 10000 | J63: 50000 | K63: 12000 | L63: 1-7 | M63: 79000 | N63: 8 | O63: =RC[-7]-RC[-6]-RC[-5]-(RC[-4]*7)-RC[-2] -> 2165200 | P63: 0 | Q63: =RC[1]/RC[-11] -> 68626.436781609198 | R63: =RC[-10]-RC[-2] -> 2388200 | S63: =RC[-4]-RC[-3] -> 2165200 | T63: =RC[-1]*0.0107292 -> 23230.863839999998 | U63: =RC[-2]*0.0080388 -> 17405.609759999999 | V63: =RC[-3]*0.0067384 -> 14589.983680000001 | W63: =RC[-4]*0.0059925 -> 12974.961000000001 | X63: เครื่องปรับอากาศ 2 เครื่อง | Y63: ชุดครัว | Z63: Shower Box | AA63: Fully Furnished | AB63: เครื่องใช้ไฟฟ้า Samsung 5 รายการ | AC63: ผ่อนเงินดาวน์ 0% นาน 6 เดือน
B64: 5 | C64: B1-511 | D64: B1 | E64: 1 Br | F64: 34.799999999999997 | G64: 68626.436781609198 | H64: 2388200 | I64: 10000 | J64: 50000 | K64: 12000 | L64: 1-7 | M64: 79000 | N64: 8 | O64: =RC[-7]-RC[-6]-RC[-5]-(RC[-4]*7)-RC[-2] -> 2165200 | P64: 0 | Q64: =RC[1]/RC[-11] -> 68626.436781609198 | R64: =RC[-10]-RC[-2] -> 2388200 | S64: =RC[-4]-RC[-3] -> 2165200 | T64: =RC[-1]*0.0107292 -> 23230.863839999998 | U64: =RC[-2]*0.0080388 -> 17405.609759999999 | V64: =RC[-3]*0.0067384 -> 14589.983680000001 | W64: =RC[-4]*0.0059925 -> 12974.961000000001 | X64: เครื่องปรับอากาศ 2 เครื่อง | Y64: ชุดครัว | Z64: Shower Box | AA64: Fully Furnished | AB64: เครื่องใช้ไฟฟ้า Samsung 5 รายการ | AC64: ผ่อนเงินดาวน์ 0% นาน 6 เดือน
B65: 5 | C65: F-512 | D65: F | E65: 2 Br | F65: 67.599999999999994 | G65: 69781.065088757401 | H65: 4717200 | I65: 10000 | J65: 100000 | K65: 25000 | L65: 1-7 | M65: 153000 | N65: 8 | O65: =RC[-7]-RC[-6]-RC[-5]-(RC[-4]*7)-RC[-2] -> 4279200 | P65: 0 | Q65: =RC[1]/RC[-11] -> 69781.065088757401 | R65: =RC[-10]-RC[-2] -> 4717200 | S65: =RC[-4]-RC[-3] -> 4279200 | T65: =RC[-1]*0.0107292 -> 45912.392639999998 | U65: =RC[-2]*0.0080388 -> 34399.632960000003 | V65: =RC[-3]*0.0067384 -> 28834.96128 | W65: =RC[-4]*0.0059925 -> 25643.106000000003 | X65: เครื่องปรับอากาศ 3 เครื่อง | Y65: ชุดครัว | Z65: Shower Box | AA65: Fully Furnished | AB65: เครื่องใช้ไฟฟ้า Samsung 5 รายการ | AC65: ผ่อนเงินดาวน์ 0% นาน 6 เดือน
B66: 5 | C66: A-513 | D66: A | E66: Studio | F66: 29.9 | G66: 67655.51839464884 | H66: 2022900 | I66: 10000 | J66: 50000 | K66: 9900 | L66: 1-7 | M66: 61000 | N66: 8 | O66: =RC[-7]-RC[-6]-RC[-5]-(RC[-4]*7)-RC[-2] -> 1832600 | P66: 0 | Q66: =RC[1]/RC[-11] -> 67655.51839464884 | R66: =RC[-10]-RC[-2] -> 2022900 | S66: =RC[-4]-RC[-3] -> 1832600 | T66: =RC[-1]*0.0107292 -> 19662.331920000001 | U66: =RC[-2]*0.0080388 -> 14731.90488 | V66: =RC[-3]*0.0067384 -> 12348.79184 | W66: =RC[-4]*0.0059925 -> 10981.855500000001 | X66: เครื่องปรับอากาศ 1 เครื่อง | Y66: ชุดครัว | Z66: Shower Box | AA66: Fully Furnished | AB66: เครื่องใช้ไฟฟ้า Samsung 5 รายการ | AC66: ผ่อนเงินดาวน์ 0% นาน 6 เดือน
B67: 5 | C67: A1-514 | D67: A1 | E67: Studio | F67: 29.9 | G67: 69327.759197324413 | H67: 2072900 | I67: 10000 | J67: 50000 | K67: 9900 | L67: 1-7 | M67: 61000 | N67: 8 | O67: =RC[-7]-RC[-6]-RC[-5]-(RC[-4]*7)-RC[-2] -> 1882600 | P67: 0 | Q67: =RC[1]/RC[-11] -> 69327.759197324413 | R67: =RC[-10]-RC[-2] -> 2072900 | S67: =RC[-4]-RC[-3] -> 1882600 | T67: =RC[-1]*0.0107292 -> 20198.79192 | U67: =RC[-2]*0.0080388 -> 15133.844880000001 | V67: =RC[-3]*0.0067384 -> 12685.71184 | W67: =RC[-4]*0.0059925 -> 11281.480500000001 | X67: เครื่องปรับอากาศ 2 เครื่อง | Y67: ชุดครัว | Z67: Shower Box | AA67: Fully Furnished | AB67: เครื่องใช้ไฟฟ้า Samsung 5 รายการ | AC67: ผ่อนเงินดาวน์ 0% นาน 6 เดือน
B68: 5 | C68: B1-515 | D68: B1 | E68: 1 Br | F68: 34.799999999999997 | G68: 68626.436781609198 | H68: 2388200 | I68: 10000 | J68: 50000 | K68: 12000 | L68: 1-7 | M68: 79000 | N68: 8 | O68: =RC[-7]-RC[-6]-RC[-5]-(RC[-4]*7)-RC[-2] -> 2165200 | P68: 0 | Q68: =RC[1]/RC[-11] -> 68626.436781609198 | R68: =RC[-10]-RC[-2] -> 2388200 | S68: =RC[-4]-RC[-3] -> 2165200 | T68: =RC[-1]*0.0107292 -> 23230.863839999998 | U68: =RC[-2]*0.0080388 -> 17405.609759999999 | V68: =RC[-3]*0.0067384 -> 14589.983680000001 | W68: =RC[-4]*0.0059925 -> 12974.961000000001 | X68: เครื่องปรับอากาศ 2 เครื่อง | Y68: ชุดครัว | Z68: Shower Box | AA68: Fully Furnished | AB68: เครื่องใช้ไฟฟ้า Samsung 5 รายการ | AC68: ผ่อนเงินดาวน์ 0% นาน 6 เดือน
A69: Sold Out | B69: 5 | C69: E-516 | D69: E | E69: 2 Br | F69: 50.3 | G69: 64800 | H69: 3259440
B70: 5 | C70: C-517 | D70: C | E70: 1 Br | F70: 37.299999999999997 | G70: 69319.034852546916 | H70: 2585600 | I70: 10000 | J70: 50000 | K70: 14000 | L70: 1-7 | M70: 83000 | N70: 8 | O70: =RC[-7]-RC[-6]-RC[-5]-(RC[-4]*7)-RC[-2] -> 2344600 | P70: 0 | Q70: =RC[1]/RC[-11] -> 69319.034852546916 | R70: =RC[-10]-RC[-2] -> 2585600 | S70: =RC[-4]-RC[-3] -> 2344600 | T70: =RC[-1]*0.0107292 -> 25155.68232 | U70: =RC[-2]*0.0080388 -> 18847.770480000003 | V70: =RC[-3]*0.0067384 -> 15798.852640000001 | W70: =RC[-4]*0.0059925 -> 14050.015500000001 | X70: เครื่องปรับอากาศ 2 เครื่อง | Y70: ชุดครัว | Z70: Shower Box | AA70: Fully Furnished | AB70: เครื่องใช้ไฟฟ้า Samsung 5 รายการ | AC70: ผ่อนเงินดาวน์ 0% นาน 6 เดือน
A71: Sold Out | B71: 5 | C71: B-518 | D71: B | E71: 1 Br | F71: 30.8 | G71: 64350 | H71: 1981980
A72: Sold Out | B72: 6 | C72: B1-601 | D72: B1 | E72: 1 Br | F72: 34.799999999999997 | G72: 65250 | H72: 2270700
A73: Sold Out | B73: 6 | C73: B1-602 | D73: B1 | E73: 1 Br | F73: 34.799999999999997 | G73: 69500 | H73: 2418600
B74: 6 | C74: G-603 | D74: G | E74: 2 Br | F74: 70.8 | G74: 70881.355932203398 | H74: 5018400 | I74: 10000 | J74: 100000 | K74: 26000 | L74: 1-7 | M74: 173000 | N74: 8 | O74: =RC[-7]-RC[-6]-RC[-5]-(RC[-4]*7)-RC[-2] -> 4553400 | P74: 0 | Q74: =RC[1]/RC[-11] -> 70881.355932203398 | R74: =RC[-10]-RC[-2] -> 5018400 | S74: =RC[-4]-RC[-3] -> 4553400 | T74: =RC[-1]*0.0107292 -> 48854.33928 | U74: =RC[-2]*0.0080388 -> 36603.871920000005 | V74: =RC[-3]*0.0067384 -> 30682.630560000001 | W74: =RC[-4]*0.0059925 -> 27286.249500000002 | X74: เครื่องปรับอากาศ 3 เครื่อง | Y74: ชุดครัว | Z74: Shower Box | AA74: Fully Furnished | AB74: เครื่องใช้ไฟฟ้า Samsung 5 รายการ | AC74: ผ่อนเงินดาวน์ 0% นาน 6 เดือน
B75: 6 | C75: B1-604 | D75: B1 | E75: 1 Br | F75: 34.799999999999997 | G75: 69626.436781609198 | H75: 2423000 | I75: 10000 | J75: 50000 | K75: 12000 | L75: 1-7 | M75: 83000 | N75: 8 | O75: =RC[-7]-RC[-6]-RC[-5]-(RC[-4]*7)-RC[-2] -> 2196000 | P75: 0 | Q75: =RC[1]/RC[-11] -> 69626.436781609198 | R75: =RC[-10]-RC[-2] -> 2423000 | S75: =RC[-4]-RC[-3] -> 2196000 | T75: =RC[-1]*0.0107292 -> 23561.323199999999 | U75: =RC[-2]*0.0080388 -> 17653.2048 | V75: =RC[-3]*0.0067384 -> 14797.526400000001 | W75: =RC[-4]*0.0059925 -> 13159.53 | X75: เครื่องปรับอากาศ 2 เครื่อง | Y75: ชุดครัว | Z75: Shower Box | AA75: Fully Furnished | AB75: เครื่องใช้ไฟฟ้า Samsung 5 รายการ | AC75: ผ่อนเงินดาวน์ 0% นาน 6 เดือน
B76: 6 | C76: B-605 | D76: B | E76: 1 Br | F76: 30.8 | G76: 69253.246753246756 | H76: 2133000 | I76: 10000 | J76: 50000 | K76: 10000 | L76: 1-7 | M76: 70000 | N76: 8 | O76: =RC[-7]-RC[-6]-RC[-5]-(RC[-4]*7)-RC[-2] -> 1933000 | P76: 0 | Q76: =RC[1]/RC[-11] -> 69253.246753246756 | R76: =RC[-10]-RC[-2] -> 2133000 | S76: =RC[-4]-RC[-3] -> 1933000 | T76: =RC[-1]*0.0107292 -> 20739.543599999997 | U76: =RC[-2]*0.0080388 -> 15539.000400000001 | V76: =RC[-3]*0.0067384 -> 13025.3272 | W76: =RC[-4]*0.0059925 -> 11583.502500000001 | X76: เครื่องปรับอากาศ 2 เครื่อง | Y76: ชุดครัว | Z76: Shower Box | AA76: Fully Furnished | AB76: เครื่องใช้ไฟฟ้า Samsung 5 รายการ | AC76: ผ่อนเงินดาวน์ 0% นาน 6 เดือน
B77: 6 | C77: B-606 | D77: B | E77: 1 Br | F77: 30.8 | G77: 69253.246753246756 | H77: 2133000 | I77: 10000 | J77: 50000 | K77: 10000 | L77: 1-7 | M77: 70000 | N77: 8 | O77: =RC[-7]-RC[-6]-RC[-5]-(RC[-4]*7)-RC[-2] -> 1933000 | P77: 0 | Q77: =RC[1]/RC[-11] -> 69253.246753246756 | R77: =RC[-10]-RC[-2] -> 2133000 | S77: =RC[-4]-RC[-3] -> 1933000 | T77: =RC[-1]*0.0107292 -> 20739.543599999997 | U77: =RC[-2]*0.0080388 -> 15539.000400000001 | V77: =RC[-3]*0.0067384 -> 13025.3272 | W77: =RC[-4]*0.0059925 -> 11583.502500000001 | X77: เครื่องปรับอากาศ 2 เครื่อง | Y77: ชุดครัว | Z77: Shower Box | AA77: Fully Furnished | AB77: เครื่องใช้ไฟฟ้า Samsung 5 รายการ | AC77: ผ่อนเงินดาวน์ 0% นาน 6 เดือน
B78: 6 | C78: D-607 | D78: D | E78: 1 Br | F78: 39.4 | G78: 70461.928934010153 | H78: 2776200 | I78: 10000 | J78: 50000 | K78: 15000 | L78: 1-7 | M78: 93000 | N78: 8 | O78: =RC[-7]-RC[-6]-RC[-5]-(RC[-4]*7)-RC[-2] -> 2518200 | P78: 0 | Q78: =RC[1]/RC[-11] -> 70461.928934010153 | R78: =RC[-10]-RC[-2] -> 2776200 | S78: =RC[-4]-RC[-3] -> 2518200 | T78: =RC[-1]*0.0107292 -> 27018.27144 | U78: =RC[-2]*0.0080388 -> 20243.30616 | V78: =RC[-3]*0.0067384 -> 16968.638880000002 | W78: =RC[-4]*0.0059925 -> 15090.3135 | X78: เครื่องปรับอากาศ 2 เครื่อง | Y78: ชุดครัว | Z78: Shower Box | AA78: Fully Furnished | AB78: เครื่องใช้ไฟฟ้า Samsung 5 รายการ | AC78: ผ่อนเงินดาวน์ 0% นาน 6 เดือน
B79: 6 | C79: B1-608 | D79: B1 | E79: 1 Br | F79: 34.799999999999997 | G79: 69626.436781609198 | H79: 2423000 | I79: 10000 | J79: 50000 | K79: 12000 | L79: 1-7 | M79: 83000 | N79: 8 | O79: =RC[-7]-RC[-6]-RC[-5]-(RC[-4]*7)-RC[-2] -> 2196000 | P79: 0 | Q79: =RC[1]/RC[-11] -> 69626.436781609198 | R79: =RC[-10]-RC[-2] -> 2423000 | S79: =RC[-4]-RC[-3] -> 2196000 | T79: =RC[-1]*0.0107292 -> 23561.323199999999 | U79: =RC[-2]*0.0080388 -> 17653.2048 | V79: =RC[-3]*0.0067384 -> 14797.526400000001 | W79: =RC[-4]*0.0059925 -> 13159.53 | X79: เครื่องปรับอากาศ 2 เครื่อง | Y79: ชุดครัว | Z79: Shower Box | AA79: Fully Furnished | AB79: เครื่องใช้ไฟฟ้า Samsung 5 รายการ | AC79: ผ่อนเงินดาวน์ 0% นาน 6 เดือน
B80: 6 | C80: B1-609 | D80: B1 | E80: 1 Br | F80: 34.799999999999997 | G80: 69626.436781609198 | H80: 2423000 | I80: 10000 | J80: 50000 | K80: 12000 | L80: 1-7 | M80: 83000 | N80: 8 | O80: =RC[-7]-RC[-6]-RC[-5]-(RC[-4]*7)-RC[-2] -> 2196000 | P80: 0 | Q80: =RC[1]/RC[-11] -> 69626.436781609198 | R80: =RC[-10]-RC[-2] -> 2423000 | S80: =RC[-4]-RC[-3] -> 2196000 | T80: =RC[-1]*0.0107292 -> 23561.323199999999 | U80: =RC[-2]*0.0080388 -> 17653.2048 | V80: =RC[-3]*0.0067384 -> 14797.526400000001 | W80: =RC[-4]*0.0059925 -> 13159.53 | X80: เครื่องปรับอากาศ 2 เครื่อง | Y80: ชุดครัว | Z80: Shower Box | AA80: Fully Furnished | AB80: เครื่องใช้ไฟฟ้า Samsung 5 รายการ | AC80: ผ่อนเงินดาวน์ 0% นาน 6 เดือน
B81: 6 | C81: B1-610 | D81: B1 | E81: 1 Br | F81: 34.799999999999997 | G81: 69626.436781609198 | H81: 2423000 | I81: 10000 | J81: 50000 | K81: 12000 | L81: 1-7 | M81: 83000 | N81: 8 | O81: =RC[-7]-RC[-6]-RC[-5]-(RC[-4]*7)-RC[-2] -> 2196000 | P81: 0 | Q81: =RC[1]/RC[-11] -> 69626.436781609198 | R81: =RC[-10]-RC[-2] -> 2423000 | S81: =RC[-4]-RC[-3] -> 2196000 | T81: =RC[-1]*0.0107292 -> 23561.323199999999 | U81: =RC[-2]*0.0080388 -> 17653.2048 | V81: =RC[-3]*0.0067384 -> 14797.526400000001 | W81: =RC[-4]*0.0059925 -> 13159.53 | X81: เครื่องปรับอากาศ 2 เครื่อง | Y81: ชุดครัว | Z81: Shower Box | AA81: Fully Furnished | AB81: เครื่องใช้ไฟฟ้า Samsung 5 รายการ | AC81: ผ่อนเงินดาวน์ 0% นาน 6 เดือน
B82: 6 | C82: B1-611 | D82: B1 | E82: 1 Br | F82: 34.799999999999997 | G82: 69626.436781609198 | H82: 2423000 | I82: 10000 | J82: 50000 | K82: 12000 | L82: 1-7 | M82: 83000 | N82: 8 | O82: =RC[-7]-RC[-6]-RC[-5]-(RC[-4]*7)-RC[-2] -> 2196000 | P82: 0 | Q82: =RC[1]/RC[-11] -> 69626.436781609198 | R82: =RC[-10]-RC[-2] -> 2423000 | S82: =RC[-4]-RC[-3] -> 2196000 | T82: =RC[-1]*0.0107292 -> 23561.323199999999 | U82: =RC[-2]*0.0080388 -> 17653.2048 | V82: =RC[-3]*0.0067384 -> 14797.526400000001 | W82: =RC[-4]*0.0059925 -> 13159.53 | X82: เครื่องปรับอากาศ 2 เครื่อง | Y82: ชุดครัว | Z82: Shower Box | AA82: Fully Furnished | AB82: เครื่องใช้ไฟฟ้า Samsung 5 รายการ | AC82: ผ่อนเงินดาวน์ 0% นาน 6 เดือน
B83: 6 | C83: F-612 | D83: F | E83: 2 Br | F83: 67.599999999999994 | G83: 70781.065088757401 | H83: 4784800 | I83: 10000 | J83: 100000 | K83: 25000 | L83: 1-7 | M83: 159000 | N83: 8 | O83: =RC[-7]-RC[-6]-RC[-5]-(RC[-4]*7)-RC[-2] -> 4340800 | P83: 0 | Q83: =RC[1]/RC[-11] -> 70781.065088757401 | R83: =RC[-10]-RC[-2] -> 4784800 | S83: =RC[-4]-RC[-3] -> 4340800 | T83: =RC[-1]*0.0107292 -> 46573.31136 | U83: =RC[-2]*0.0080388 -> 34894.823040000003 | V83: =RC[-3]*0.0067384 -> 29250.046720000002 | W83: =RC[-4]*0.0059925 -> 26012.244000000002 | X83: เครื่องปรับอากาศ 3 เครื่อง | Y83: ชุดครัว | Z83: Shower Box | AA83: Fully Furnished | AB83: เครื่องใช้ไฟฟ้า Samsung 5 รายการ | AC83: ผ่อนเงินดาวน์ 0% นาน 6 เดือน
A84: Sold Out | B84: 6 | C84: A-613 | D84: A | E84: Studio | F84: 29.9 | G84: 72000 | H84: 2152800
B85: 6 | C85: A1-614 | D85: A1 | E85: Studio | F85: 29.9 | G85: 70327.759197324413 | H85: 2102800 | I85: 10000 | J85: 50000 | K85: 9900 | L85: 1-7 | M85: 64000 | N85: 8 | O85: =RC[-7]-RC[-6]-RC[-5]-(RC[-4]*7)-RC[-2] -> 1909500 | P85: 0 | Q85: =RC[1]/RC[-11] -> 70327.759197324413 | R85: =RC[-10]-RC[-2] -> 2102800 | S85: =RC[-4]-RC[-3] -> 1909500 | T85: =RC[-1]*0.0107292 -> 20487.4074 | U85: =RC[-2]*0.0080388 -> 15350.088600000001 | V85: =RC[-3]*0.0067384 -> 12866.9748 | W85: =RC[-4]*0.0059925 -> 11442.678750000001 | X85: เครื่องปรับอากาศ 2 เครื่อง | Y85: ชุดครัว | Z85: Shower Box | AA85: Fully Furnished | AB85: เครื่องใช้ไฟฟ้า Samsung 5 รายการ | AC85: ผ่อนเงินดาวน์ 0% นาน 6 เดือน
B86: 6 | C86: B1-615 | D86: B1 | E86: 1 Br | F86: 34.799999999999997 | G86: 69626.436781609198 | H86: 2423000 | I86: 10000 | J86: 50000 | K86: 12000 | L86: 1-7 | M86: 83000 | N86: 8 | O86: =RC[-7]-RC[-6]-RC[-5]-(RC[-4]*7)-RC[-2] -> 2196000 | P86: 0 | Q86: =RC[1]/RC[-11] -> 69626.436781609198 | R86: =RC[-10]-RC[-2] -> 2423000 | S86: =RC[-4]-RC[-3] -> 2196000 | T86: =RC[-1]*0.0107292 -> 23561.323199999999 | U86: =RC[-2]*0.0080388 -> 17653.2048 | V86: =RC[-3]*0.0067384 -> 14797.526400000001 | W86: =RC[-4]*0.0059925 -> 13159.53 | X86: เครื่องปรับอากาศ 2 เครื่อง | Y86: ชุดครัว | Z86: Shower Box | AA86: Fully Furnished | AB86: เครื่องใช้ไฟฟ้า Samsung 5 รายการ | AC86: ผ่อนเงินดาวน์ 0% นาน 6 เดือน
B87: 6 | C87: E-616 | D87: E | E87: 2 Br | F87: 50.3 | G87: 70017.892644135194 | H87: 3521900 | I87: 10000 | J87: 100000 | K87: 17000 | L87: 1-7 | M87: 101000 | N87: 8 | O87: =RC[-7]-RC[-6]-RC[-5]-(RC[-4]*7)-RC[-2] -> 3191900 | P87: 0 | Q87: =RC[1]/RC[-11] -> 70017.892644135194 | R87: =RC[-10]-RC[-2] -> 3521900 | S87: =RC[-4]-RC[-3] -> 3191900 | T87: =RC[-1]*0.0107292 -> 34246.533479999998 | U87: =RC[-2]*0.0080388 -> 25659.045720000002 | V87: =RC[-3]*0.0067384 -> 21508.29896 | W87: =RC[-4]*0.0059925 -> 19127.460750000002 | X87: เครื่องปรับอากาศ 3 เครื่อง | Y87: ชุดครัว | Z87: Shower Box | AA87: Fully Furnished | AB87: เครื่องใช้ไฟฟ้า Samsung 5 รายการ | AC87: ผ่อนเงินดาวน์ 0% นาน 6 เดือน
A88: Sold Out | B88: 6 | C88: C-617 | D88: C | E88: 1 Br | F88: 37.299999999999997 | G88: 65700 | H88: 2450610
A89: Sold Out | B89: 6 | C89: B-618 | D89: B | E89: 1 Br | F89: 30.8 | G89: 72500 | H89: 2233000
B90: 7 | C90: B1-701 | D90: B1 | E90: 1 Br | F90: 34.799999999999997 | G90: 70626.436781609198 | H90: 2457800 | I90: 10000 | J90: 50000 | K90: 12000 | L90: 1-7 | M90: 86000 | N90: 8 | O90: =RC[-7]-RC[-6]-RC[-5]-(RC[-4]*7)-RC[-2] -> 2227800 | P90: 0 | Q90: =RC[1]/RC[-11] -> 70626.436781609198 | R90: =RC[-10]-RC[-2] -> 2457800 | S90: =RC[-4]-RC[-3] -> 2227800 | T90: =RC[-1]*0.0107292 -> 23902.511759999998 | U90: =RC[-2]*0.0080388 -> 17908.838640000002 | V90: =RC[-3]*0.0067384 -> 15011.80752 | W90: =RC[-4]*0.0059925 -> 13350.0915 | X90: เครื่องปรับอากาศ 2 เครื่อง | Y90: ชุดครัว | Z90: Shower Box | AA90: Fully Furnished | AB90: เครื่องใช้ไฟฟ้า Samsung 5 รายการ | AC90: ผ่อนเงินดาวน์ 0% นาน 6 เดือน
A91: Sold Out | B91: 7 | C91: B1-702 | D91: B1 | E91: 1 Br | F91: 34.799999999999997 | G91: 73500 | H91: 2557800
B92: 7 | C92: G-703 | D92: G | E92: 2 Br | F92: 70.8 | G92: 71881.355932203398 | H92: 5089200 | I92: 10000 | J92: 100000 | K92: 26000 | L92: 1-7 | M92: 179000 | N92: 8 | O92: =RC[-7]-RC[-6]-RC[-5]-(RC[-4]*7)-RC[-2] -> 4618200 | P92: 0 | Q92: =RC[1]/RC[-11] -> 71881.355932203398 | R92: =RC[-10]-RC[-2] -> 5089200 | S92: =RC[-4]-RC[-3] -> 4618200 | T92: =RC[-1]*0.0107292 -> 49549.591439999997 | U92: =RC[-2]*0.0080388 -> 37124.786160000003 | V92: =RC[-3]*0.0067384 -> 31119.278880000002 | W92: =RC[-4]*0.0059925 -> 27674.5635 | X92: เครื่องปรับอากาศ 3 เครื่อง | Y92: ชุดครัว | Z92: Shower Box | AA92: Fully Furnished | AB92: เครื่องใช้ไฟฟ้า Samsung 5 รายการ | AC92: ผ่อนเงินดาวน์ 0% นาน 6 เดือน
B93: 7 | C93: B1-704 | D93: B1 | E93: 1 Br | F93: 34.799999999999997 | G93: 70626.436781609198 | H93: 2457800 | I93: 10000 | J93: 50000 | K93: 12000 | L93: 1-7 | M93: 86000 | N93: 8 | O93: =RC[-7]-RC[-6]-RC[-5]-(RC[-4]*7)-RC[-2] -> 2227800 | P93: 0 | Q93: =RC[1]/RC[-11] -> 70626.436781609198 | R93: =RC[-10]-RC[-2] -> 2457800 | S93: =RC[-4]-RC[-3] -> 2227800 | T93: =RC[-1]*0.0107292 -> 23902.511759999998 | U93: =RC[-2]*0.0080388 -> 17908.838640000002 | V93: =RC[-3]*0.0067384 -> 15011.80752 | W93: =RC[-4]*0.0059925 -> 13350.0915 | X93: เครื่องปรับอากาศ 2 เครื่อง | Y93: ชุดครัว | Z93: Shower Box | AA93: Fully Furnished | AB93: เครื่องใช้ไฟฟ้า Samsung 5 รายการ | AC93: ผ่อนเงินดาวน์ 0% นาน 6 เดือน
B94: 7 | C94: B-705 | D94: B | E94: 1 Br | F94: 30.8 | G94: 70253.246753246756 | H94: 2163800 | I94: 10000 | J94: 50000 | K94: 10000 | L94: 1-7 | M94: 73000 | N94: 8 | O94: =RC[-7]-RC[-6]-RC[-5]-(RC[-4]*7)-RC[-2] -> 1960800 | P94: 0 | Q94: =RC[1]/RC[-11] -> 70253.246753246756 | R94: =RC[-10]-RC[-2] -> 2163800 | S94: =RC[-4]-RC[-3] -> 1960800 | T94: =RC[-1]*0.0107292 -> 21037.815360000001 | U94: =RC[-2]*0.0080388 -> 15762.47904 | V94: =RC[-3]*0.0067384 -> 13212.65472 | W94: =RC[-4]*0.0059925 -> 11750.094000000001 | X94: เครื่องปรับอากาศ 2 เครื่อง | Y94: ชุดครัว | Z94: Shower Box | AA94: Fully Furnished | AB94: เครื่องใช้ไฟฟ้า Samsung 5 รายการ | AC94: ผ่อนเงินดาวน์ 0% นาน 6 เดือน
B95: 7 | C95: B-706 | D95: B | E95: 1 Br | F95: 30.8 | G95: 70253.246753246756 | H95: 2163800 | I95: 10000 | J95: 50000 | K95: 10000 | L95: 1-7 | M95: 73000 | N95: 8 | O95: =RC[-7]-RC[-6]-RC[-5]-(RC[-4]*7)-RC[-2] -> 1960800 | P95: 0 | Q95: =RC[1]/RC[-11] -> 70253.246753246756 | R95: =RC[-10]-RC[-2] -> 2163800 | S95: =RC[-4]-RC[-3] -> 1960800 | T95: =RC[-1]*0.0107292 -> 21037.815360000001 | U95: =RC[-2]*0.0080388 -> 15762.47904 | V95: =RC[-3]*0.0067384 -> 13212.65472 | W95: =RC[-4]*0.0059925 -> 11750.094000000001 | X95: เครื่องปรับอากาศ 2 เครื่อง | Y95: ชุดครัว | Z95: Shower Box | AA95: Fully Furnished | AB95: เครื่องใช้ไฟฟ้า Samsung 5 รายการ | AC95: ผ่อนเงินดาวน์ 0% นาน 6 เดือน
B96: 7 | C96: D-707 | D96: D | E96: 1 Br | F96: 39.4 | G96: 71461.928934010153 | H96: 2815600 | I96: 10000 | J96: 50000 | K96: 15000 | L96: 1-7 | M96: 97000 | N96: 8 | O96: =RC[-7]-RC[-6]-RC[-5]-(RC[-4]*7)-RC[-2] -> 2553600 | P96: 0 | Q96: =RC[1]/RC[-11] -> 71461.928934010153 | R96: =RC[-10]-RC[-2] -> 2815600 | S96: =RC[-4]-RC[-3] -> 2553600 | T96: =RC[-1]*0.0107292 -> 27398.08512 | U96: =RC[-2]*0.0080388 -> 20527.879680000002 | V96: =RC[-3]*0.0067384 -> 17207.178240000001 | W96: =RC[-4]*0.0059925 -> 15302.448 | X96: เครื่องปรับอากาศ 2 เครื่อง | Y96: ชุดครัว | Z96: Shower Box | AA96: Fully Furnished | AB96: เครื่องใช้ไฟฟ้า Samsung 5 รายการ | AC96: ผ่อนเงินดาวน์ 0% นาน 6 เดือน
B97: 7 | C97: B1-708 | D97: B1 | E97: 1 Br | F97: 34.799999999999997 | G97: 70626.436781609198 | H97: 2457800 | I97: 10000 | J97: 50000 | K97: 12000 | L97: 1-7 | M97: 86000 | N97: 8 | O97: =RC[-7]-RC[-6]-RC[-5]-(RC[-4]*7)-RC[-2] -> 2227800 | P97: 0 | Q97: =RC[1]/RC[-11] -> 70626.436781609198 | R97: =RC[-10]-RC[-2] -> 2457800 | S97: =RC[-4]-RC[-3] -> 2227800 | T97: =RC[-1]*0.0107292 -> 23902.511759999998 | U97: =RC[-2]*0.0080388 -> 17908.838640000002 | V97: =RC[-3]*0.0067384 -> 15011.80752 | W97: =RC[-4]*0.0059925 -> 13350.0915 | X97: เครื่องปรับอากาศ 2 เครื่อง | Y97: ชุดครัว | Z97: Shower Box | AA97: Fully Furnished | AB97: เครื่องใช้ไฟฟ้า Samsung 5 รายการ | AC97: ผ่อนเงินดาวน์ 0% นาน 6 เดือน
B98: 7 | C98: B1-709 | D98: B1 | E98: 1 Br | F98: 34.799999999999997 | G98: 70626.436781609198 | H98: 2457800 | I98: 10000 | J98: 50000 | K98: 12000 | L98: 1-7 | M98: 86000 | N98: 8 | O98: =RC[-7]-RC[-6]-RC[-5]-(RC[-4]*7)-RC[-2] -> 2227800 | P98: 0 | Q98: =RC[1]/RC[-11] -> 70626.436781609198 | R98: =RC[-10]-RC[-2] -> 2457800 | S98: =RC[-4]-RC[-3] -> 2227800 | T98: =RC[-1]*0.0107292 -> 23902.511759999998 | U98: =RC[-2]*0.0080388 -> 17908.838640000002 | V98: =RC[-3]*0.0067384 -> 15011.80752 | W98: =RC[-4]*0.0059925 -> 13350.0915 | X98: เครื่องปรับอากาศ 2 เครื่อง | Y98: ชุดครัว | Z98: Shower Box | AA98: Fully Furnished | AB98: เครื่องใช้ไฟฟ้า Samsung 5 รายการ | AC98: ผ่อนเงินดาวน์ 0% นาน 6 เดือน
B99: 7 | C99: B1-710 | D99: B1 | E99: 1 Br | F99: 34.799999999999997 | G99: 70626.436781609198 | H99: 2457800 | I99: 10000 | J99: 50000 | K99: 12000 | L99: 1-7 | M99: 86000 | N99: 8 | O99: =RC[-7]-RC[-6]-RC[-5]-(RC[-4]*7)-RC[-2] -> 2227800 | P99: 0 | Q99: =RC[1]/RC[-11] -> 70626.436781609198 | R99: =RC[-10]-RC[-2] -> 2457800 | S99: =RC[-4]-RC[-3] -> 2227800 | T99: =RC[-1]*0.0107292 -> 23902.511759999998 | U99: =RC[-2]*0.0080388 -> 17908.838640000002 | V99: =RC[-3]*0.0067384 -> 15011.80752 | W99: =RC[-4]*0.0059925 -> 13350.0915 | X99: เครื่องปรับอากาศ 2 เครื่อง | Y99: ชุดครัว | Z99: Shower Box | AA99: Fully Furnished | AB99: เครื่องใช้ไฟฟ้า Samsung 5 รายการ | AC99: ผ่อนเงินดาวน์ 0% นาน 6 เดือน
B100: 7 | C100: B1-711 | D100: B1 | E100: 1 Br | F100: 34.799999999999997 | G100: 70626.436781609198 | H100: 2457800 | I100: 10000 | J100: 50000 | K100: 12000 | L100: 1-7 | M100: 86000 | N100: 8 | O100: =RC[-7]-RC[-6]-RC[-5]-(RC[-4]*7)-RC[-2] -> 2227800 | P100: 0 | Q100: =RC[1]/RC[-11] -> 70626.436781609198 | R100: =RC[-10]-RC[-2] -> 2457800 | S100: =RC[-4]-RC[-3] -> 2227800 | T100: =RC[-1]*0.0107292 -> 23902.511759999998 | U100: =RC[-2]*0.0080388 -> 17908.838640000002 | V100: =RC[-3]*0.0067384 -> 15011.80752 | W100: =RC[-4]*0.0059925 -> 13350.0915 | X100: เครื่องปรับอากาศ 2 เครื่อง | Y100: ชุดครัว | Z100: Shower Box | AA100: Fully Furnished | AB100: เครื่องใช้ไฟฟ้า Samsung 5 รายการ | AC100: ผ่อนเงินดาวน์ 0% นาน 6 เดือน
B101: 7 | C101: F-712 | D101: F | E101: 2 Br | F101: 67.599999999999994 | G101: 71781.065088757401 | H101: 4852400 | I101: 10000 | J101: 100000 | K101: 25000 | L101: 1-7 | M101: 165000 | N101: 8 | O101: =RC[-7]-RC[-6]-RC[-5]-(RC[-4]*7)-RC[-2] -> 4402400 | P101: 0 | Q101: =RC[1]/RC[-11] -> 71781.065088757401 | R101: =RC[-10]-RC[-2] -> 4852400 | S101: =RC[-4]-RC[-3] -> 4402400 | T101: =RC[-1]*0.0107292 -> 47234.230080000001 | U101: =RC[-2]*0.0080388 -> 35390.013120000003 | V101: =RC[-3]*0.0067384 -> 29665.132160000001 | W101: =RC[-4]*0.0059925 -> 26381.382000000001 | X101: เครื่องปรับอากาศ 3 เครื่อง | Y101: ชุดครัว | Z101: Shower Box | AA101: Fully Furnished | AB101: เครื่องใช้ไฟฟ้า Samsung 5 รายการ | AC101: ผ่อนเงินดาวน์ 0% นาน 6 เดือน
B102: 7 | C102: A-713 | D102: A | E102: Studio | F102: 29.9 | G102: 69655.51839464884 | H102: 2082700 | I102: 10000 | J102: 50000 | K102: 9900 | L102: 1-7 | M102: 67000 | N102: 8 | O102: =RC[-7]-RC[-6]-RC[-5]-(RC[-4]*7)-RC[-2] -> 1886400 | P102: 0 | Q102: =RC[1]/RC[-11] -> 69655.51839464884 | R102: =RC[-10]-RC[-2] -> 2082700 | S102: =RC[-4]-RC[-3] -> 1886400 | T102: =RC[-1]*0.0107292 -> 20239.562879999998 | U102: =RC[-2]*0.0080388 -> 15164.392320000001 | V102: =RC[-3]*0.0067384 -> 12711.31776 | W102: =RC[-4]*0.0059925 -> 11304.252 | X102: เครื่องปรับอากาศ 1 เครื่อง | Y102: ชุดครัว | Z102: Shower Box | AA102: Fully Furnished | AB102: เครื่องใช้ไฟฟ้า Samsung 5 รายการ | AC102: ผ่อนเงินดาวน์ 0% นาน 6 เดือน
A103: Sold Out | B103: 7 | C103: A-714 | D103: A | E103: Studio | F103: 29.9 | G103: 65700 | H103: 1964430
B104: 7 | C104: B1-715 | D104: B1 | E104: 1 Br | F104: 34.799999999999997 | G104: 70626.436781609198 | H104: 2457800 | I104: 10000 | J104: 50000 | K104: 12000 | L104: 1-7 | M104: 86000 | N104: 8 | O104: =RC[-7]-RC[-6]-RC[-5]-(RC[-4]*7)-RC[-2] -> 2227800 | P104: 0 | Q104: =RC[1]/RC[-11] -> 70626.436781609198 | R104: =RC[-10]-RC[-2] -> 2457800 | S104: =RC[-4]-RC[-3] -> 2227800 | T104: =RC[-1]*0.0107292 -> 23902.511759999998 | U104: =RC[-2]*0.0080388 -> 17908.838640000002 | V104: =RC[-3]*0.0067384 -> 15011.80752 | W104: =RC[-4]*0.0059925 -> 13350.0915 | X104: เครื่องปรับอากาศ 2 เครื่อง | Y104: ชุดครัว | Z104: Shower Box | AA104: Fully Furnished | AB104: เครื่องใช้ไฟฟ้า Samsung 5 รายการ | AC104: ผ่อนเงินดาวน์ 0% นาน 6 เดือน
B105: 7 | C105: E-716 | D105: E | E105: 2 Br | F105: 50.3 | G105: 71017.892644135194 | H105: 3572200 | I105: 10000 | J105: 100000 | K105: 17000 | L105: 1-7 | M105: 105000 | N105: 8 | O105: =RC[-7]-RC[-6]-RC[-5]-(RC[-4]*7)-RC[-2] -> 3238200 | P105: 0 | Q105: =RC[1]/RC[-11] -> 71017.892644135194 | R105: =RC[-10]-RC[-2] -> 3572200 | S105: =RC[-4]-RC[-3] -> 3238200 | T105: =RC[-1]*0.0107292 -> 34743.295440000002 | U105: =RC[-2]*0.0080388 -> 26031.242160000002 | V105: =RC[-3]*0.0067384 -> 21820.28688 | W105: =RC[-4]*0.0059925 -> 19404.913500000002 | X105: เครื่องปรับอากาศ 3 เครื่อง | Y105: ชุดครัว | Z105: Shower Box | AA105: Fully Furnished | AB105: เครื่องใช้ไฟฟ้า Samsung 5 รายการ | AC105: ผ่อนเงินดาวน์ 0% นาน 6 เดือน
B106: 7 | C106: C-717 | D106: C | E106: 1 Br | F106: 37.299999999999997 | G106: 71319.034852546916 | H106: 2660200 | I106: 10000 | J106: 50000 | K106: 14000 | L106: 1-7 | M106: 90000 | N106: 8 | O106: =RC[-7]-RC[-6]-RC[-5]-(RC[-4]*7)-RC[-2] -> 2412200 | P106: 0 | Q106: =RC[1]/RC[-11] -> 71319.034852546916 | R106: =RC[-10]-RC[-2] -> 2660200 | S106: =RC[-4]-RC[-3] -> 2412200 | T106: =RC[-1]*0.0107292 -> 25880.97624 | U106: =RC[-2]*0.0080388 -> 19391.193360000001 | V106: =RC[-3]*0.0067384 -> 16254.368480000001 | W106: =RC[-4]*0.0059925 -> 14455.1085 | X106: เครื่องปรับอากาศ 2 เครื่อง | Y106: ชุดครัว | Z106: Shower Box | AA106: Fully Furnished | AB106: เครื่องใช้ไฟฟ้า Samsung 5 รายการ | AC106: ผ่อนเงินดาวน์ 0% นาน 6 เดือน
A107: Sold Out | B107: 7 | C107: B-718 | D107: B | E107: 1 Br | F107: 30.8 | G107: 66150 | H107: 2037420
B108: 8 | C108: B1-801 | D108: B1 | E108: 1 Br | F108: 34.799999999999997 | G108: 71626.436781609198 | H108: 2492600 | I108: 10000 | J108: 50000 | K108: 12000 | L108: 1-7 | M108: 89000 | N108: 8 | O108: =RC[-7]-RC[-6]-RC[-5]-(RC[-4]*7)-RC[-2] -> 2259600 | P108: 0 | Q108: =RC[1]/RC[-11] -> 71626.436781609198 | R108: =RC[-10]-RC[-2] -> 2492600 | S108: =RC[-4]-RC[-3] -> 2259600 | T108: =RC[-1]*0.0107292 -> 24243.70032 | U108: =RC[-2]*0.0080388 -> 18164.47248 | V108: =RC[-3]*0.0067384 -> 15226.08864 | W108: =RC[-4]*0.0059925 -> 13540.653 | X108: เครื่องปรับอากาศ 2 เครื่อง | Y108: ชุดครัว | Z108: Shower Box | AA108: Fully Furnished | AB108: เครื่องใช้ไฟฟ้า Samsung 5 รายการ | AC108: ผ่อนเงินดาวน์ 0% นาน 6 เดือน
B109: 8 | C109: B1-802 | D109: B1 | E109: 1 Br | F109: 34.799999999999997 | G109: 71626.436781609198 | H109: 2492600 | I109: 10000 | J109: 50000 | K109: 12000 | L109: 1-7 | M109: 89000 | N109: 8 | O109: =RC[-7]-RC[-6]-RC[-5]-(RC[-4]*7)-RC[-2] -> 2259600 | P109: 0 | Q109: =RC[1]/RC[-11] -> 71626.436781609198 | R109: =RC[-10]-RC[-2] -> 2492600 | S109: =RC[-4]-RC[-3] -> 2259600 | T109: =RC[-1]*0.0107292 -> 24243.70032 | U109: =RC[-2]*0.0080388 -> 18164.47248 | V109: =RC[-3]*0.0067384 -> 15226.08864 | W109: =RC[-4]*0.0059925 -> 13540.653 | X109: เครื่องปรับอากาศ 2 เครื่อง | Y109: ชุดครัว | Z109: Shower Box | AA109: Fully Furnished | AB109: เครื่องใช้ไฟฟ้า Samsung 5 รายการ | AC109: ผ่อนเงินดาวน์ 0% นาน 6 เดือน
B110: 8 | C110: G-803 | D110: G | E110: 2 Br | F110: 70.8 | G110: 72881.355932203398 | H110: 5160000 | I110: 10000 | J110: 100000 | K110: 26000 | L110: 1-7 | M110: 185000 | N110: 8 | O110: =RC[-7]-RC[-6]-RC[-5]-(RC[-4]*7)-RC[-2] -> 4683000 | P110: 0 | Q110: =RC[1]/RC[-11] -> 72881.355932203398 | R110: =RC[-10]-RC[-2] -> 5160000 | S110: =RC[-4]-RC[-3] -> 4683000 | T110: =RC[-1]*0.0107292 -> 50244.8436 | U110: =RC[-2]*0.0080388 -> 37645.700400000002 | V110: =RC[-3]*0.0067384 -> 31555.927200000002 | W110: =RC[-4]*0.0059925 -> 28062.877500000002 | X110: เครื่องปรับอากาศ 3 เครื่อง | Y110: ชุดครัว | Z110: Shower Box | AA110: Fully Furnished | AB110: เครื่องใช้ไฟฟ้า Samsung 5 รายการ | AC110: ผ่อนเงินดาวน์ 0% นาน 6 เดือน
A111: Sold Out | B111: 8 | C111: B1-804 | D111: B1 | E111: 1 Br | F111: 34.799999999999997 | G111: 67050 | H111: 2333340
B112: 8 | C112: B-805 | D112: B | E112: 1 Br | F112: 30.8 | G112: 71253.246753246756 | H112: 2194600 | I112: 10000 | J112: 50000 | K112: 10000 | L112: 1-7 | M112: 76000 | N112: 8 | O112: =RC[-7]-RC[-6]-RC[-5]-(RC[-4]*7)-RC[-2] -> 1988600 | P112: 0 | Q112: =RC[1]/RC[-11] -> 71253.246753246756 | R112: =RC[-10]-RC[-2] -> 2194600 | S112: =RC[-4]-RC[-3] -> 1988600 | T112: =RC[-1]*0.0107292 -> 21336.08712 | U112: =RC[-2]*0.0080388 -> 15985.957680000001 | V112: =RC[-3]*0.0067384 -> 13399.982240000001 | W112: =RC[-4]*0.0059925 -> 11916.685500000001 | X112: เครื่องปรับอากาศ 2 เครื่อง | Y112: ชุดครัว | Z112: Shower Box | AA112: Fully Furnished | AB112: เครื่องใช้ไฟฟ้า Samsung 5 รายการ | AC112: ผ่อนเงินดาวน์ 0% นาน 6 เดือน
B113: 8 | C113: B-806 | D113: B | E113: 1 Br | F113: 30.8 | G113: 71253.246753246756 | H113: 2194600 | I113: 10000 | J113: 50000 | K113: 10000 | L113: 1-7 | M113: 76000 | N113: 8 | O113: =RC[-7]-RC[-6]-RC[-5]-(RC[-4]*7)-RC[-2] -> 1988600 | P113: 0 | Q113: =RC[1]/RC[-11] -> 71253.246753246756 | R113: =RC[-10]-RC[-2] -> 2194600 | S113: =RC[-4]-RC[-3] -> 1988600 | T113: =RC[-1]*0.0107292 -> 21336.08712 | U113: =RC[-2]*0.0080388 -> 15985.957680000001 | V113: =RC[-3]*0.0067384 -> 13399.982240000001 | W113: =RC[-4]*0.0059925 -> 11916.685500000001 | X113: เครื่องปรับอากาศ 2 เครื่อง | Y113: ชุดครัว | Z113: Shower Box | AA113: Fully Furnished | AB113: เครื่องใช้ไฟฟ้า Samsung 5 รายการ | AC113: ผ่อนเงินดาวน์ 0% นาน 6 เดือน
B114: 8 | C114: D-807 | D114: D | E114: 1 Br | F114: 39.4 | G114: 72461.928934010153 | H114: 2855000 | I114: 10000 | J114: 50000 | K114: 15000 | L114: 1-7 | M114: 100000 | N114: 8 | O114: =RC[-7]-RC[-6]-RC[-5]-(RC[-4]*7)-RC[-2] -> 2590000 | P114: 0 | Q114: =RC[1]/RC[-11] -> 72461.928934010153 | R114: =RC[-10]-RC[-2] -> 2855000 | S114: =RC[-4]-RC[-3] -> 2590000 | T114: =RC[-1]*0.0107292 -> 27788.627999999997 | U114: =RC[-2]*0.0080388 -> 20820.492000000002 | V114: =RC[-3]*0.0067384 -> 17452.456000000002 | W114: =RC[-4]*0.0059925 -> 15520.575000000001 | X114: เครื่องปรับอากาศ 2 เครื่อง | Y114: ชุดครัว | Z114: Shower Box | AA114: Fully Furnished | AB114: เครื่องใช้ไฟฟ้า Samsung 5 รายการ | AC114: ผ่อนเงินดาวน์ 0% นาน 6 เดือน
B115: 8 | C115: B1-808 | D115: B1 | E115: 1 Br | F115: 34.799999999999997 | G115: 71626.436781609198 | H115: 2492600 | I115: 10000 | J115: 50000 | K115: 12000 | L115: 1-7 | M115: 89000 | N115: 8 | O115: =RC[-7]-RC[-6]-RC[-5]-(RC[-4]*7)-RC[-2] -> 2259600 | P115: 0 | Q115: =RC[1]/RC[-11] -> 71626.436781609198 | R115: =RC[-10]-RC[-2] -> 2492600 | S115: =RC[-4]-RC[-3] -> 2259600 | T115: =RC[-1]*0.0107292 -> 24243.70032 | U115: =RC[-2]*0.0080388 -> 18164.47248 | V115: =RC[-3]*0.0067384 -> 15226.08864 | W115: =RC[-4]*0.0059925 -> 13540.653 | X115: เครื่องปรับอากาศ 2 เครื่อง | Y115: ชุดครัว | Z115: Shower Box | AA115: Fully Furnished | AB115: เครื่องใช้ไฟฟ้า Samsung 5 รายการ | AC115: ผ่อนเงินดาวน์ 0% นาน 6 เดือน
B116: 8 | C116: B1-809 | D116: B1 | E116: 1 Br | F116: 34.799999999999997 | G116: 71626.436781609198 | H116: 2492600 | I116: 10000 | J116: 50000 | K116: 12000 | L116: 1-7 | M116: 89000 | N116: 8 | O116: =RC[-7]-RC[-6]-RC[-5]-(RC[-4]*7)-RC[-2] -> 2259600 | P116: 0 | Q116: =RC[1]/RC[-11] -> 71626.436781609198 | R116: =RC[-10]-RC[-2] -> 2492600 | S116: =RC[-4]-RC[-3] -> 2259600 | T116: =RC[-1]*0.0107292 -> 24243.70032 | U116: =RC[-2]*0.0080388 -> 18164.47248 | V116: =RC[-3]*0.0067384 -> 15226.08864 | W116: =RC[-4]*0.0059925 -> 13540.653 | X116: เครื่องปรับอากาศ 2 เครื่อง | Y116: ชุดครัว | Z116: Shower Box | AA116: Fully Furnished | AB116: เครื่องใช้ไฟฟ้า Samsung 5 รายการ | AC116: ผ่อนเงินดาวน์ 0% นาน 6 เดือน
B117: 8 | C117: B1-810 | D117: B1 | E117: 1 Br | F117: 34.799999999999997 | G117: 71626.436781609198 | H117: 2492600 | I117: 10000 | J117: 50000 | K117: 12000 | L117: 1-7 | M117: 89000 | N117: 8 | O117: =RC[-7]-RC[-6]-RC[-5]-(RC[-4]*7)-RC[-2] -> 2259600 | P117: 0 | Q117: =RC[1]/RC[-11] -> 71626.436781609198 | R117: =RC[-10]-RC[-2] -> 2492600 | S117: =RC[-4]-RC[-3] -> 2259600 | T117: =RC[-1]*0.0107292 -> 24243.70032 | U117: =RC[-2]*0.0080388 -> 18164.47248 | V117: =RC[-3]*0.0067384 -> 15226.08864 | W117: =RC[-4]*0.0059925 -> 13540.653 | X117: เครื่องปรับอากาศ 2 เครื่อง | Y117: ชุดครัว | Z117: Shower Box | AA117: Fully Furnished | AB117: เครื่องใช้ไฟฟ้า Samsung 5 รายการ | AC117: ผ่อนเงินดาวน์ 0% นาน 6 เดือน
B118: 8 | C118: B1-811 | D118: B1 | E118: 1 Br | F118: 34.799999999999997 | G118: 71626.436781609198 | H118: 2492600 | I118: 10000 | J118: 50000 | K118: 12000 | L118: 1-7 | M118: 89000 | N118: 8 | O118: =RC[-7]-RC[-6]-RC[-5]-(RC[-4]*7)-RC[-2] -> 2259600 | P118: 0 | Q118: =RC[1]/RC[-11] -> 71626.436781609198 | R118: =RC[-10]-RC[-2] -> 2492600 | S118: =RC[-4]-RC[-3] -> 2259600 | T118: =RC[-1]*0.0107292 -> 24243.70032 | U118: =RC[-2]*0.0080388 -> 18164.47248 | V118: =RC[-3]*0.0067384 -> 15226.08864 | W118: =RC[-4]*0.0059925 -> 13540.653 | X118: เครื่องปรับอากาศ 2 เครื่อง | Y118: ชุดครัว | Z118: Shower Box | AA118: Fully Furnished | AB118: เครื่องใช้ไฟฟ้า Samsung 5 รายการ | AC118: ผ่อนเงินดาวน์ 0% นาน 6 เดือน
B119: 8 | C119: F-812 | D119: F | E119: 2 Br | F119: 67.599999999999994 | G119: 72781.065088757401 | H119: 4920000 | I119: 10000 | J119: 100000 | K119: 25000 | L119: 1-7 | M119: 171000 | N119: 8 | O119: =RC[-7]-RC[-6]-RC[-5]-(RC[-4]*7)-RC[-2] -> 4464000 | P119: 0 | Q119: =RC[1]/RC[-11] -> 72781.065088757401 | R119: =RC[-10]-RC[-2] -> 4920000 | S119: =RC[-4]-RC[-3] -> 4464000 | T119: =RC[-1]*0.0107292 -> 47895.148799999995 | U119: =RC[-2]*0.0080388 -> 35885.203200000004 | V119: =RC[-3]*0.0067384 -> 30080.2176 | W119: =RC[-4]*0.0059925 -> 26750.52 | X119: เครื่องปรับอากาศ 3 เครื่อง | Y119: ชุดครัว | Z119: Shower Box | AA119: Fully Furnished | AB119: เครื่องใช้ไฟฟ้า Samsung 5 รายการ | AC119: ผ่อนเงินดาวน์ 0% นาน 6 เดือน
B120: 8 | C120: A-813 | D120: A | E120: Studio | F120: 29.9 | G120: 70655.51839464884 | H120: 2112600 | I120: 10000 | J120: 50000 | K120: 9900 | L120: 1-7 | M120: 69000 | N120: 8 | O120: =RC[-7]-RC[-6]-RC[-5]-(RC[-4]*7)-RC[-2] -> 1914300 | P120: 0 | Q120: =RC[1]/RC[-11] -> 70655.51839464884 | R120: =RC[-10]-RC[-2] -> 2112600 | S120: =RC[-4]-RC[-3] -> 1914300 | T120: =RC[-1]*0.0107292 -> 20538.90756 | U120: =RC[-2]*0.0080388 -> 15388.674840000001 | V120: =RC[-3]*0.0067384 -> 12899.31912 | W120: =RC[-4]*0.0059925 -> 11471.44275 | X120: เครื่องปรับอากาศ 1 เครื่อง | Y120: ชุดครัว | Z120: Shower Box | AA120: Fully Furnished | AB120: เครื่องใช้ไฟฟ้า Samsung 5 รายการ | AC120: ผ่อนเงินดาวน์ 0% นาน 6 เดือน
B121: 8 | C121: A1-814 | D121: A1 | E121: Studio | F121: 29.9 | G121: 72327.759197324413 | H121: 2162600 | I121: 10000 | J121: 50000 | K121: 9900 | L121: 1-7 | M121: 69000 | N121: 8 | O121: =RC[-7]-RC[-6]-RC[-5]-(RC[-4]*7)-RC[-2] -> 1964300 | P121: 0 | Q121: =RC[1]/RC[-11] -> 72327.759197324413 | R121: =RC[-10]-RC[-2] -> 2162600 | S121: =RC[-4]-RC[-3] -> 1964300 | T121: =RC[-1]*0.0107292 -> 21075.367559999999 | U121: =RC[-2]*0.0080388 -> 15790.61484 | V121: =RC[-3]*0.0067384 -> 13236.23912 | W121: =RC[-4]*0.0059925 -> 11771.06775 | X121: เครื่องปรับอากาศ 2 เครื่อง | Y121: ชุดครัว | Z121: Shower Box | AA121: Fully Furnished | AB121: เครื่องใช้ไฟฟ้า Samsung 5 รายการ | AC121: ผ่อนเงินดาวน์ 0% นาน 6 เดือน
B122: 8 | C122: B1-815 | D122: B1 | E122: 1 Br | F122: 34.799999999999997 | G122: 71626.436781609198 | H122: 2492600 | I122: 10000 | J122: 50000 | K122: 12000 | L122: 1-7 | M122: 89000 | N122: 8 | O122: =RC[-7]-RC[-6]-RC[-5]-(RC[-4]*7)-RC[-2] -> 2259600 | P122: 0 | Q122: =RC[1]/RC[-11] -> 71626.436781609198 | R122: =RC[-10]-RC[-2] -> 2492600 | S122: =RC[-4]-RC[-3] -> 2259600 | T122: =RC[-1]*0.0107292 -> 24243.70032 | U122: =RC[-2]*0.0080388 -> 18164.47248 | V122: =RC[-3]*0.0067384 -> 15226.08864 | W122: =RC[-4]*0.0059925 -> 13540.653 | X122: เครื่องปรับอากาศ 2 เครื่อง | Y122: ชุดครัว | Z122: Shower Box | AA122: Fully Furnished | AB122: เครื่องใช้ไฟฟ้า Samsung 5 รายการ | AC122: ผ่อนเงินดาวน์ 0% นาน 6 เดือน
A123: Sold Out | B123: 8 | C123: E-816 | D123: E | E123: 2 Br | F123: 50.3 | G123: 72000 | H123: 3621600
B124: 8 | C124: C-817 | D124: C | E124: 1 Br | F124: 37.299999999999997 | G124: 72319.034852546916 | H124: 2697500 | I124: 10000 | J124: 50000 | K124: 14000 | L124: 1-7 | M124: 93000 | N124: 8 | O124: =RC[-7]-RC[-6]-RC[-5]-(RC[-4]*7)-RC[-2] -> 2446500 | P124: 0 | Q124: =RC[1]/RC[-11] -> 72319.034852546916 | R124: =RC[-10]-RC[-2] -> 2697500 | S124: =RC[-4]-RC[-3] -> 2446500 | T124: =RC[-1]*0.0107292 -> 26248.987799999999 | U124: =RC[-2]*0.0080388 -> 19666.924200000001 | V124: =RC[-3]*0.0067384 -> 16485.495600000002 | W124: =RC[-4]*0.0059925 -> 14660.651250000001 | X124: เครื่องปรับอากาศ 2 เครื่อง | Y124: ชุดครัว | Z124: Shower Box | AA124: Fully Furnished | AB124: เครื่องใช้ไฟฟ้า Samsung 5 รายการ | AC124: ผ่อนเงินดาวน์ 0% นาน 6 เดือน
B125: 8 | C125: B-818 | D125: B | E125: 1 Br | F125: 30.8 | G125: 71253.246753246756 | H125: 2194600 | I125: 10000 | J125: 50000 | K125: 10000 | L125: 1-7 | M125: 76000 | N125: 8 | O125: =RC[-7]-RC[-6]-RC[-5]-(RC[-4]*7)-RC[-2] -> 1988600 | P125: 0 | Q125: =RC[1]/RC[-11] -> 71253.246753246756 | R125: =RC[-10]-RC[-2] -> 2194600 | S125: =RC[-4]-RC[-3] -> 1988600 | T125: =RC[-1]*0.0107292 -> 21336.08712 | U125: =RC[-2]*0.0080388 -> 15985.957680000001 | V125: =RC[-3]*0.0067384 -> 13399.982240000001 | W125: =RC[-4]*0.0059925 -> 11916.685500000001 | X125: เครื่องปรับอากาศ 2 เครื่อง | Y125: ชุดครัว | Z125: Shower Box | AA125: Fully Furnished | AB125: เครื่องใช้ไฟฟ้า Samsung 5 รายการ | AC125: ผ่อนเงินดาวน์ 0% นาน 6 เดือน

Sheet: Sheet2
A1: 1 | B1: 2 | C1: 3 | D1: 4 | E1: 5 | F1: 6
A2: 2 | B2: B | C2: 1 Br | D2: 34.799999999999997 | E2: 68500 | F2: 2383800
A3: 2 | B3: B | C3: 1 Br | D3: 34.799999999999997 | E3: 68500 | F3: 2383800
A4: 2 | B4: C | C4: 2 Br | D4: 70.8 | E4: 69000 | F4: 4885200
A5: 2 | B5: B | C5: 1 Br | D5: 34.799999999999997 | E5: 68500 | F5: 2383800
A6: 2 | B6: B | C6: 1 Br | D6: 30.8 | E6: 68500 | F6: 2109800
A7: 2 | B7: C | C7: 1 Br | D7: 39.4 | E7: 69000 | F7: 2718600
A8: 2 | B8: B | C8: 1 Br | D8: 34.799999999999997 | E8: 68500 | F8: 2383800
A9: 2 | B9: B | C9: 1 Br | D9: 34.799999999999997 | E9: 68500 | F9: 2383800
A10: 2 | B10: B | C10: 1 Br | D10: 34.799999999999997 | E10: 68500 | F10: 2383800
A11: 2 | B11: B | C11: 1 Br | D11: 34.799999999999997 | E11: 68500 | F11: 2383800
A12: 2 | B12: C | C12: 2 Br | D12: 67.599999999999994 | E12: 69000 | F12: 4664400
A13: 2 | B13: A | C13: Studio | D13: 29.9 | E13: 68000 | F13: 2033200
A14: 2 | B14: A | C14: Studio | D14: 29.9 | E14: 68000 | F14: 2033200
A15: 3 | B15: B | C15: 1 Br | D15: 34.799999999999997 | E15: 69500 | F15: 2418600
A16: 3 | B16: C | C16: 1 Br | D16: 39.4 | E16: 70000 | F16: 2758000
A17: 3 | B17: B | C17: 1 Br | D17: 34.799999999999997 | E17: 69500 | F17: 2418600
A18: 3 | B18: B | C18: 1 Br | D18: 34.799999999999997 | E18: 69500 | F18: 2418600
A19: 3 | B19: B | C19: 1 Br | D19: 34.799999999999997 | E19: 69500 | F19: 2418600
A20: 3 | B20: B | C20: 1 Br | D20: 34.799999999999997 | E20: 69500 | F20: 2418600
A21: 3 | B21: C | C21: 2 Br | D21: 67.599999999999994 | E21: 70000 | F21: 4732000
A22: 3 | B22: A | C22: Studio | D22: 29.9 | E22: 69000 | F22: 2063100
A23: 3 | B23: A | C23: Studio | D23: 29.9 | E23: 69000 | F23: 2063100
A24: 3 | B24: B | C24: 1 Br | D24: 34.799999999999997 | E24: 69500 | F24: 2418600
A25: 4 | B25: B | C25: 1 Br | D25: 34.799999999999997 | E25: 70500 | F25: 2453400
A26: 4 | B26: B | C26: 1 Br | D26: 34.799999999999997 | E26: 70500 | F26: 2453400
A27: 4 | B27: B | C27: 1 Br | D27: 34.799999999999997 | E27: 70500 | F27: 2453400
A28: 4 | B28: B | C28: 1 Br | D28: 30.8 | E28: 70500 | F28: 2171400
A29: 4 | B29: C | C29: 1 Br | D29: 39.4 | E29: 71000 | F29: 2797400
A30: 4 | B30: B | C30: 1 Br | D30: 34.799999999999997 | E30: 70500 | F30: 2453400
A31: 4 | B31: B | C31: 1 Br | D31: 34.799999999999997 | E31: 70500 | F31: 2453400
A32: 4 | B32: B | C32: 1 Br | D32: 34.799999999999997 | E32: 70500 | F32: 2453400
A33: 4 | B33: B | C33: 1 Br | D33: 34.799999999999997 | E33: 70500 | F33: 2453400
A34: 4 | B34: C | C34: 2 Br | D34: 67.599999999999994 | E34: 71000 | F34: 4799600
A35: 4 | B35: A | C35: Studio | D35: 29.9 | E35: 70000 | F35: 2093000
A36: 4 | B36: A | C36: Studio | D36: 29.9 | E36: 70000 | F36: 2093000
A37: 4 | B37: B | C37: 1 Br | D37: 34.799999999999997 | E37: 70500 | F37: 2453400
A38: 4 | B38: C | C38: 1 Br | D38: 37.299999999999997 | E38: 71000 | F38: 2648300
A39: 5 | B39: B | C39: 1 Br | D39: 34.799999999999997 | E39: 71500 | F39: 2488200
A40: 5 | B40: C | C40: 2 Br | D40: 70.8 | E40: 72000 | F40: 5097600
A41: 5 | B41: B | C41: 1 Br | D41: 34.799999999999997 | E41: 71500 | F41: 2488200
A42: 5 | B42: B | C42: 1 Br | D42: 30.8 | E42: 71500 | F42: 2202200
A43: 5 | B43: B | C43: 1 Br | D43: 34.799999999999997 | E43: 71500 | F43: 2488200
A44: 5 | B44: B | C44: 1 Br | D44: 34.799999999999997 | E44: 71500 | F44: 2488200
A45: 5 | B45: B | C45: 1 Br | D45: 34.799999999999997 | E45: 71500 | F45: 2488200
A46: 5 | B46: C | C46: 2 Br | D46: 67.599999999999994 | E46: 72000 | F46: 4867200
A47: 5 | B47: A | C47: Studio | D47: 29.9 | E47: 71000 | F47: 2122900
A48: 5 | B48: A | C48: Studio | D48: 29.9 | E48: 71000 | F48: 2122900
A49: 5 | B49: B | C49: 1 Br | D49: 34.799999999999997 | E49: 71500 | F49: 2488200
A50: 5 | B50: C | C50: 1 Br | D50: 37.299999999999997 | E50: 72000 | F50: 2685600
A51: 6 | B51: C | C51: 2 Br | D51: 70.8 | E51: 73000 | F51: 5168400
A52: 6 | B52: B | C52: 1 Br | D52: 34.799999999999997 | E52: 72500 | F52: 2523000
A53: 6 | B53: B | C53: 1 Br | D53: 30.8 | E53: 72500 | F53: 2233000
A54: 6 | B54: B | C54: 1 Br | D54: 30.8 | E54: 72500 | F54: 2233000
A55: 6 | B55: C | C55: 1 Br | D55: 39.4 | E55: 73000 | F55: 2876200
A56: 6 | B56: B | C56: 1 Br | D56: 34.799999999999997 | E56: 72500 | F56: 2523000
A57: 6 | B57: B | C57: 1 Br | D57: 34.799999999999997 | E57: 72500 | F57: 2523000
A58: 6 | B58: B | C58: 1 Br | D58: 34.799999999999997 | E58: 72500 | F58: 2523000
A59: 6 | B59: B | C59: 1 Br | D59: 34.799999999999997 | E59: 72500 | F59: 2523000
A60: 6 | B60: C | C60: 2 Br | D60: 67.599999999999994 | E60: 73000 | F60: 4934800
A61: 6 | B61: A | C61: Studio | D61: 29.9 | E61: 72000 | F61: 2152800
A62: 6 | B62: B | C62: 1 Br | D62: 34.799999999999997 | E62: 72500 | F62: 2523000
A63: 6 | B63: C | C63: 2 Br | D63: 50.3 | E63: 73000 | F63: 3671900
A64: 7 | B64: B | C64: 1 Br | D64: 34.799999999999997 | E64: 73500 | F64: 2557800
A65: 7 | B65: C | C65: 2 Br | D65: 70.8 | E65: 74000 | F65: 5239200
A66: 7 | B66: B | C66: 1 Br | D66: 34.799999999999997 | E66: 73500 | F66: 2557800
A67: 7 | B67: B | C67: 1 Br | D67: 30.8 | E67: 73500 | F67: 2263800
A68: 7 | B68: B | C68: 1 Br | D68: 30.8 | E68: 73500 | F68: 2263800
A69: 7 | B69: C | C69: 1 Br | D69: 39.4 | E69: 74000 | F69: 2915600
A70: 7 | B70: B | C70: 1 Br | D70: 34.799999999999997 | E70: 73500 | F70: 2557800
A71: 7 | B71: B | C71: 1 Br | D71: 34.799999999999997 | E71: 73500 | F71: 2557800
A72: 7 | B72: B | C72: 1 Br | D72: 34.799999999999997 | E72: 73500 | F72: 2557800
A73: 7 | B73: B | C73: 1 Br | D73: 34.799999999999997 | E73: 73500 | F73: 2557800
A74: 7 | B74: C | C74: 2 Br | D74: 67.599999999999994 | E74: 74000 | F74: 5002400
A75: 7 | B75: A | C75: Studio | D75: 29.9 | E75: 73000 | F75: 2182700
A76: 7 | B76: B | C76: 1 Br | D76: 34.799999999999997 | E76: 73500 | F76: 2557800
A77: 7 | B77: C | C77: 2 Br | D77: 50.3 | E77: 74000 | F77: 3722200
A78: 7 | B78: C | C78: 1 Br | D78: 37.299999999999997 | E78: 74000 | F78: 2760200
A79: 8 | B79: B | C79: 1 Br | D79: 34.799999999999997 | E79: 74500 | F79: 2592600
A80: 8 | B80: B | C80: 1 Br | D80: 34.799999999999997 | E80: 74500 | F80: 2592600
A81: 8 | B81: C | C81: 2 Br | D81: 70.8 | E81: 75000 | F81: 5310000
A82: 8 | B82: B | C82: 1 Br | D82: 30.8 | E82: 74500 | F82: 2294600
A83: 8 | B83: B | C83: 1 Br | D83: 30.8 | E83: 74500 | F83: 2294600
A84: 8 | B84: C | C84: 1 Br | D84: 39.4 | E84: 75000 | F84: 2955000
A85: 8 | B85: B | C85: 1 Br | D85: 34.799999999999997 | E85: 74500 | F85: 2592600
A86: 8 | B86: B | C86: 1 Br | D86: 34.799999999999997 | E86: 74500 | F86: 2592600
A87: 8 | B87: B | C87: 1 Br | D87: 34.799999999999997 | E87: 74500 | F87: 2592600
A88: 8 | B88: B | C88: 1 Br | D88: 34.799999999999997 | E88: 74500 | F88: 2592600
A89: 8 | B89: C | C89: 2 Br | D89: 67.599999999999994 | E89: 75000 | F89: 5070000
A90: 8 | B90: A | C90: Studio | D90: 29.9 | E90: 74000 | F90: 2212600
A91: 8 | B91: A | C91: Studio | D91: 29.9 | E91: 74000 | F91: 2212600
A92: 8 | B92: B | C92: 1 Br | D92: 34.799999999999997 | E92: 74500 | F92: 2592600
A93: 8 | B93: C | C93: 1 Br | D93: 37.299999999999997 | E93: 75000 | F93: 2797500
A94: 8 | B94: B | C94: 1 Br | D94: 30.8 | E94: 74500 | F94: 2294600